[
    {
        "coursename": "AM 3 Precalculus for the Social Sciences",
        "description": "Introduces mathematical functions and their uses for modeling real-life problems in the social sciences. Includes inequalities, linear and quadratic equations, functions (linear, quadratic, polynomial, rational, power, exponential, logarithmic, trigonometric), inverses, and the composition of functions. Students cannot receive credit for both this course and MATH 3. MATH 3 can substitute for this course. (Formerly Applied Mathematics and Statistics 3.)",
        "genEd": "General Education Code MF",
        "credithours": "Credits 5",
        "instructor": "Instructor Marcella Gomez, Bruno Mendes, Pascale Garaud",
        "extrarequirements": "Requirements Prerequisite(s): score of 200 or higher on the mathematics placement examination (MPE), or MATH 2.",
        "quarteroffered": "Quarter Offered Winter",
        "fulldesc": "AM 3 Precalculus for the Social Sciences\nIntroduces mathematical functions and their uses for modeling real-life problems in the social sciences. Includes inequalities, linear and quadratic equations, functions (linear, quadratic, polynomial, rational, power, exponential, logarithmic, trigonometric), inverses, and the composition of functions. Students cannot receive credit for both this course and MATH 3. MATH 3 can substitute for this course. (Formerly Applied Mathematics and Statistics 3.)\nCredits 5\nInstructor Marcella Gomez, Bruno Mendes, Pascale Garaud\nRequirements Prerequisite(s): score of 200 or higher on the mathematics placement examination (MPE), or MATH 2.\nGeneral Education Code MF\nQuarter Offered Winter\n"
    },
    {
        "coursename": "AM 6 Precalculus for Statistics",
        "description": "Reviews and introduces mathematical methods useful in the elementary study of statistics, including logic, real numbers, inequalities, linear and quadratic equations, functions, graphs, exponential and logarithmic functions, and summation notation. (Formerly AMS 6.)",
        "genEd": "General Education Code MF",
        "credithours": "Credits 5",
        "instructor": "Instructor The Staff, Bruno Mendes",
        "extrarequirements": "Requirements Prerequisite(s): MATH 2 or mathematics placement examination (MPE) score of 200 or higher or higher.",
        "quarteroffered": "none",
        "fulldesc": "AM 6 Precalculus for Statistics\nReviews and introduces mathematical methods useful in the elementary study of statistics, including logic, real numbers, inequalities, linear and quadratic equations, functions, graphs, exponential and logarithmic functions, and summation notation. (Formerly AMS 6.)\nCredits 5\nInstructor The Staff, Bruno Mendes\nRequirements Prerequisite(s): MATH 2 or mathematics placement examination (MPE) score of 200 or higher or higher.\nGeneral Education Code MF\n"
    },
    {
        "coursename": "AM 10 Mathematical Methods for Engineers I",
        "description": "Applications-oriented course on complex numbers and linear algebra integrating Matlab as a computational support tool. Introduction to complex algebra. Vectors, bases and transformations, matrix algebra, solutions of linear systems, inverses and determinants, eigenvalues and eigenvectors, and geometric transformations. Students cannot receive credit for this course and for AM 10A or MATH 21. (Formerly AMS 10.)",
        "genEd": "General Education Code MF",
        "credithours": "Credits 5",
        "instructor": "Instructor Vanessa Jonsson, Hongyun Wang, Bruno Mendes, Yonathan Katznelson, Nicholas Brummell, Qi Gong, Daniele Venturi, Marcella Gomez",
        "extrarequirements": "Requirements Prerequisite(s): score of 400 or higher on the mathematics placement examination (MPE) or MATH 3.",
        "quarteroffered": "Quarter Offered Fall, Winter, Spring",
        "fulldesc": "AM 10 Mathematical Methods for Engineers I\nApplications-oriented course on complex numbers and linear algebra integrating Matlab as a computational support tool. Introduction to complex algebra. Vectors, bases and transformations, matrix algebra, solutions of linear systems, inverses and determinants, eigenvalues and eigenvectors, and geometric transformations. Students cannot receive credit for this course and for AM 10A or MATH 21. (Formerly AMS 10.)\nCredits 5\nInstructor Vanessa Jonsson, Hongyun Wang, Bruno Mendes, Yonathan Katznelson, Nicholas Brummell, Qi Gong, Daniele Venturi, Marcella Gomez\nRequirements Prerequisite(s): score of 400 or higher on the mathematics placement examination (MPE) or MATH 3.\nGeneral Education Code MF\nQuarter Offered Fall, Winter, Spring\n"
    },
    {
        "coursename": "AM 11A Mathematical Methods for Economists I",
        "description": "Introduction to mathematical tools and reasoning, with applications to economics. Topics are drawn from differential calculus in one variable and include limits, continuity, differentiation, elasticity, Taylor polynomials, and optimization. Students cannot receive credit for both this course and MATH 11A or MATH 19A or AM 15A. (AM 11A formerly AMS 11A.)",
        "genEd": "General Education Code MF",
        "credithours": "Credits 5",
        "instructor": "Instructor Bruno Mendes, Yonatan Katznelson",
        "extrarequirements": "Requirements Students who have already taken MATH 11A or MATH 19A should not take this course. Prerequisite(s): score of 300 or higher on the mathematics placement examination (MPE), AM 3 or AM 6, or MATH 3.",
        "quarteroffered": "Quarter Offered Fall, Winter, Spring",
        "fulldesc": "AM 11A Mathematical Methods for Economists I\nIntroduction to mathematical tools and reasoning, with applications to economics. Topics are drawn from differential calculus in one variable and include limits, continuity, differentiation, elasticity, Taylor polynomials, and optimization. Students cannot receive credit for both this course and MATH 11A or MATH 19A or AM 15A. (AM 11A formerly AMS 11A.)\nCredits 5\nCross Listed Courses ECON 11A\nInstructor Bruno Mendes, Yonatan Katznelson\nRequirements Students who have already taken MATH 11A or MATH 19A should not take this course. Prerequisite(s): score of 300 or higher on the mathematics placement examination (MPE), AM 3 or AM 6, or MATH 3.\nGeneral Education Code MF\nQuarter Offered Fall, Winter, Spring\n"
    },
    {
        "coursename": "AM 11B Mathematical Methods for Economists II",
        "description": "Mathematical tools and reasoning, with applications to economics. Topics are drawn from multivariable differential calculus and single variable integral calculus, and include partial derivatives, linear and quadratic approximation, optimization with and without constraints, Lagrange multipliers, definite and indefinite integrals, and elementary differential equations. Students cannot receive credit for both this course and MATH 11B or MATH 19B or AM 15B. (AM 11B formerly AMS 11B.)",
        "genEd": "General Education Code MF",
        "credithours": "Credits 5",
        "instructor": "Instructor Bruno Mendes, Yonatan Katznelson, Bruno The Staff",
        "extrarequirements": "Requirements Prerequisite(s): AM 11A, or ECON 11A, or MATH 11A, or MATH 19A.",
        "quarteroffered": "Quarter Offered Fall, Winter, Spring",
        "fulldesc": "AM 11B Mathematical Methods for Economists II\nMathematical tools and reasoning, with applications to economics. Topics are drawn from multivariable differential calculus and single variable integral calculus, and include partial derivatives, linear and quadratic approximation, optimization with and without constraints, Lagrange multipliers, definite and indefinite integrals, and elementary differential equations. Students cannot receive credit for both this course and MATH 11B or MATH 19B or AM 15B. (AM 11B formerly AMS 11B.)\nCredits 5\nCross Listed Courses ECON 11B\nInstructor Bruno Mendes, Yonatan Katznelson, Bruno The Staff\nRequirements Prerequisite(s): AM 11A, or ECON 11A, or MATH 11A, or MATH 19A.\nGeneral Education Code MF\nQuarter Offered Fall, Winter, Spring\n"
    },
    {
        "coursename": "AM 20 Mathematical Methods for Engineers II",
        "description": "Applications-oriented class on ordinary differential equations (ODEs) and systems of ODEs using Matlab as a computational support tool. Covers linear ODEs and systems of linear ODEs; nonlinear ODEs using substitution and Laplace transforms; phase-plane analysis; introduction to numerical methods. Students cannot receive credit for this course and for AM 20A or MATH 24. (Formerly AMS 20.)",
        "genEd": "General Education Code MF",
        "credithours": "Credits 5",
        "instructor": "Instructor The Staff, Yonathan Katznelson, Qi Gong, Dongwook Lee, Abhishek Halder",
        "extrarequirements": "Requirements Prerequisite(s): MATH 19B, and AM 10 or MATH 21.",
        "quarteroffered": "Quarter Offered Winter, Spring",
        "fulldesc": "AM 20 Mathematical Methods for Engineers II\nApplications-oriented class on ordinary differential equations (ODEs) and systems of ODEs using Matlab as a computational support tool. Covers linear ODEs and systems of linear ODEs; nonlinear ODEs using substitution and Laplace transforms; phase-plane analysis; introduction to numerical methods. Students cannot receive credit for this course and for AM 20A or MATH 24. (Formerly AMS 20.)\nCredits 5\nInstructor The Staff, Yonathan Katznelson, Qi Gong, Dongwook Lee, Abhishek Halder\nRequirements Prerequisite(s): MATH 19B, and AM 10 or MATH 21.\nGeneral Education Code MF\nQuarter Offered Winter, Spring\n"
    },
    {
        "coursename": "AM 30 Multivariate Calculus for Engineers",
        "description": "Advanced multivariate calculus for engineering majors. Coordinate systems, parametric curves, and surfaces; partial derivatives, gradient, Taylor expansion, stationary points, constrained optimization; integrals in multiple dimensions; integrals over curves and surfaces. Applications to engineering form an integral part of the course.",
        "genEd": "none",
        "credithours": "Credits 5",
        "instructor": "Instructor Qi Gong, Yonathan Katznelson, Pascale Garaud, Nicholas Brummell",
        "extrarequirements": "Requirements Prerequisite(s): AM 10; MATH 19B or MATH 20B.",
        "quarteroffered": "Quarter Offered Fall, Spring",
        "fulldesc": "AM 30 Multivariate Calculus for Engineers\nAdvanced multivariate calculus for engineering majors. Coordinate systems, parametric curves, and surfaces; partial derivatives, gradient, Taylor expansion, stationary points, constrained optimization; integrals in multiple dimensions; integrals over curves and surfaces. Applications to engineering form an integral part of the course.\nCredits 5\nInstructor Qi Gong, Yonathan Katznelson, Pascale Garaud, Nicholas Brummell\nRequirements Prerequisite(s): AM 10; MATH 19B or MATH 20B.\nQuarter Offered Fall, Spring\n"
    },
    {
        "coursename": "AM 100 Mathematical Methods for Engineers",
        "description": "Covers important concepts in applied mathematics, including complex analysis, vector calculus, Fourier Series, and integral transforms. Applications of the methods to various problems in science and engineering are discussed.",
        "genEd": "none",
        "credithours": "Credits 5",
        "instructor": "Instructor The Staff, Hongyun Wang",
        "extrarequirements": "Requirements Prerequisite(s): AM 20 and AM 30, or by permission of instructor.",
        "quarteroffered": "Quarter Offered Fall",
        "fulldesc": "AM 100 Mathematical Methods for Engineers\nCovers important concepts in applied mathematics, including complex analysis, vector calculus, Fourier Series, and integral transforms. Applications of the methods to various problems in science and engineering are discussed.\nCredits 5\nInstructor The Staff, Hongyun Wang\nRequirements Prerequisite(s): AM 20 and AM 30, or by permission of instructor.\nQuarter Offered Fall\n"
    },
    {
        "coursename": "AM 107 Introduction to Fluid Dynamics",
        "description": "Covers fundamental topics in fluid dynamics: Euler and Lagrange descriptions of continuum dynamics; conservation laws for inviscid and viscous flows; potential flows; exact solutions of the Navier-Stokes equation; boundary layer theory; gravity waves. Students cannot receive credit for this course and AM 217. (AM 107 formerly AMS 107.)",
        "genEd": "none",
        "credithours": "Credits 5",
        "instructor": "Instructor The Staff, Nicholas Brummell",
        "extrarequirements": "Requirements Prerequisite(s): AM 112 or MATH 107 or PHYS 116C or EART 111.",
        "quarteroffered": "Quarter Offered Winter",
        "fulldesc": "AM 107 Introduction to Fluid Dynamics\nCovers fundamental topics in fluid dynamics: Euler and Lagrange descriptions of continuum dynamics; conservation laws for inviscid and viscous flows; potential flows; exact solutions of the Navier-Stokes equation; boundary layer theory; gravity waves. Students cannot receive credit for this course and AM 217. (AM 107 formerly AMS 107.)\nCredits 5\nCross Listed Courses PHYS 107\nInstructor The Staff, Nicholas Brummell\nRequirements Prerequisite(s): AM 112 or MATH 107 or PHYS 116C or EART 111.\nQuarter Offered Winter\n"
    },
    {
        "coursename": "AM 112 Introduction to Partial Differential Equations",
        "description": "Focuses on analytical methods for partial differential equations (PDEs) of two variables, including: the method of characteristics for first-order PDEs; classification of second-order PDEs; separation of variables; Sturm-Liouville theory; and Green's functions. Illustrates each method using applications taken from examples in physics. Students cannot receive credit for this course and AM 212A.",
        "genEd": "none",
        "credithours": "Credits 5",
        "instructor": "Instructor Marcella Gomez, Hongyun Wang",
        "extrarequirements": "Requirements Prerequisite(s): AM 100 or by permission of the instructor. Enrollment is restricted to juniors and seniors.",
        "quarteroffered": "Quarter Offered Winter",
        "fulldesc": "AM 112 Introduction to Partial Differential Equations\nFocuses on analytical methods for partial differential equations (PDEs) of two variables, including: the method of characteristics for first-order PDEs; classification of second-order PDEs; separation of variables; Sturm-Liouville theory; and Green's functions. Illustrates each method using applications taken from examples in physics. Students cannot receive credit for this course and AM 212A.\nCredits 5\nInstructor Marcella Gomez, Hongyun Wang\nRequirements Prerequisite(s): AM 100 or by permission of the instructor. Enrollment is restricted to juniors and seniors.\nQuarter Offered Winter\n"
    },
    {
        "coursename": "AM 114 Introduction to Dynamical Systems",
        "description": "Introduces continuous and discrete dynamical systems. Topics include: fixed points; stability; limit cycles; bifurcations; transition to and characterization of chaos; fractals. Examples are drawn from sciences and engineering. Students cannot receive credit for this course and AM 214 or MATH 145. (Formerly AMS 114.)",
        "genEd": "General Education Code MF",
        "credithours": "Credits 5",
        "instructor": "Instructor Pascale Garaud, Qi Gong, Dejan Milutinovic, Daniele Venturi",
        "extrarequirements": "Requirements Prerequisite(s): AM 20; or MATH 21 and MATH 24; or PHYS 116A. Enrollment is restricted to sophomores, juniors and seniors.",
        "quarteroffered": "Quarter Offered Fall",
        "fulldesc": "AM 114 Introduction to Dynamical Systems\nIntroduces continuous and discrete dynamical systems. Topics include: fixed points; stability; limit cycles; bifurcations; transition to and characterization of chaos; fractals. Examples are drawn from sciences and engineering. Students cannot receive credit for this course and AM 214 or MATH 145. (Formerly AMS 114.)\nCredits 5\nInstructor Pascale Garaud, Qi Gong, Dejan Milutinovic, Daniele Venturi\nRequirements Prerequisite(s): AM 20; or MATH 21 and MATH 24; or PHYS 116A. Enrollment is restricted to sophomores, juniors and seniors.\nGeneral Education Code MF\nQuarter Offered Fall\n"
    },
    {
        "coursename": "AM 115 Stochastic Modeling in Biology",
        "description": "Application of differential equations, probability, and stochastic processes to problems in cell, organismal, and population biology. Topics include systems biology, cellular processes, gene-regulation, and population biology. Students may not receive credit for this course and AM 215.",
        "genEd": "none",
        "credithours": "Credits 5",
        "instructor": "Instructor Marcella Gomez",
        "extrarequirements": "Requirements Prerequisite(s): STAT 131 and AM 20; a university-level course in biology, and operational knowledge of a programming language; or consent of instructor.",
        "quarteroffered": "Quarter Offered Spring",
        "fulldesc": "AM 115 Stochastic Modeling in Biology\nApplication of differential equations, probability, and stochastic processes to problems in cell, organismal, and population biology. Topics include systems biology, cellular processes, gene-regulation, and population biology. Students may not receive credit for this course and AM 215.\nCredits 5\nInstructor Marcella Gomez\nRequirements Prerequisite(s): STAT 131 and AM 20; a university-level course in biology, and operational knowledge of a programming language; or consent of instructor.\nQuarter Offered Spring\n"
    },
    {
        "coursename": "AM 129 Foundations of Scientific Computing for Scientists and Engineers",
        "description": "Covers fundamental aspects of scientific computing for research. Students are introduced to algorithmic development, programming (including the use of compilers, libraries, debugging, optimization, code publication), computational infrastructure, and data analysis tools, gaining hands-on experience through practical assignments. Basic programming experience is assumed.",
        "genEd": "none",
        "credithours": "Credits 5",
        "instructor": "Instructor The Staff, Dongwook Lee",
        "extrarequirements": "Requirements Prerequisite(s): AM 10 and MATH 11A; or AM 10 and MATH 19A; or AM 10 and MATH 20A; or MATH 21 and MATH 11A; or MATH 21 and MATH 19A; or MATH 21 and MATH 20A.",
        "quarteroffered": "Quarter Offered Fall",
        "fulldesc": "AM 129 Foundations of Scientific Computing for Scientists and Engineers\nCovers fundamental aspects of scientific computing for research. Students are introduced to algorithmic development, programming (including the use of compilers, libraries, debugging, optimization, code publication), computational infrastructure, and data analysis tools, gaining hands-on experience through practical assignments. Basic programming experience is assumed.\nCredits 5\nInstructor The Staff, Dongwook Lee\nRequirements Prerequisite(s): AM 10 and MATH 11A; or AM 10 and MATH 19A; or AM 10 and MATH 20A; or MATH 21 and MATH 11A; or MATH 21 and MATH 19A; or MATH 21 and MATH 20A.\nQuarter Offered Fall\n"
    },
    {
        "coursename": "AM 147 Computational Methods and Applications",
        "description": "Applications of computational methods to solving mathematical problems using Matlab. Topics include solution of nonlinear equations, linear systems, differential equations, sparse matrix solver, and eigenvalue problems. Students cannot receive credit for this course and MATH 148. (Formerly AMS 147.)",
        "genEd": "General Education Code MF",
        "credithours": "Credits 5",
        "instructor": "Instructor Hongyun Wang, Daniele Venturi, Abhishek Halder, Gong Qi",
        "extrarequirements": "Requirements Prerequisite(s): AM 10 or MATH 21. Knowledge of differential equations (AM 20 or MATH 24) is recommended.",
        "quarteroffered": "Quarter Offered Winter",
        "fulldesc": "AM 147 Computational Methods and Applications\nApplications of computational methods to solving mathematical problems using Matlab. Topics include solution of nonlinear equations, linear systems, differential equations, sparse matrix solver, and eigenvalue problems. Students cannot receive credit for this course and MATH 148. (Formerly AMS 147.)\nCredits 5\nInstructor Hongyun Wang, Daniele Venturi, Abhishek Halder, Gong Qi\nRequirements Prerequisite(s): AM 10 or MATH 21. Knowledge of differential equations (AM 20 or MATH 24) is recommended.\nGeneral Education Code MF\nQuarter Offered Winter\n"
    },
    {
        "coursename": "AM 148 GPU Programming for Scientific Computations",
        "description": "This second course in scientific computing focuses on the use of parallel processing on GPUs with CUDA. Basic topics covered include the idea of parallelism and parallel architectures. The course then presents key parallel algorithms on GPUs such as scan, reduce, histogram and stencil, and compound algorithms. Applications to scientific computing are drawn from problems in linear algebra, curve fitting, FFTs, systems of ODEs and PDEs, and image processing. Finally, the course presents optimization strategies specific to GPUs. Basic knowledge of Unix, and C is assumed. (Formerly AMS 148.)",
        "genEd": "none",
        "credithours": "Credits 5",
        "instructor": "Instructor Pascale Garaud, The Staff",
        "extrarequirements": "Requirements Prerequisite(s): AM 147 or MATH 148 or PHYS 115. Enrollment is restricted to juniors and seniors.",
        "quarteroffered": "none",
        "fulldesc": "AM 148 GPU Programming for Scientific Computations\nThis second course in scientific computing focuses on the use of parallel processing on GPUs with CUDA. Basic topics covered include the idea of parallelism and parallel architectures. The course then presents key parallel algorithms on GPUs such as scan, reduce, histogram and stencil, and compound algorithms. Applications to scientific computing are drawn from problems in linear algebra, curve fitting, FFTs, systems of ODEs and PDEs, and image processing. Finally, the course presents optimization strategies specific to GPUs. Basic knowledge of Unix, and C is assumed. (Formerly AMS 148.)\nCredits 5\nInstructor Pascale Garaud, The Staff\nRequirements Prerequisite(s): AM 147 or MATH 148 or PHYS 115. Enrollment is restricted to juniors and seniors.\n"
    },
    {
        "coursename": "AM 170A Mathematical Modeling 1",
        "description": "Introduction to mathematical modeling emphasizing model construction, tool selection, methods of solution, critical analysis of the results, and professional-level presentation of the results (written and oral). Focuses on problems that can be solved using only analytical tools, and simple Matlab routines. Applications are drawn from a variety of fields such as physics, biology, engineering, and economics.",
        "genEd": "none",
        "credithours": "Credits 5",
        "instructor": "Instructor Pascale Garaud",
        "extrarequirements": "Requirements Prerequisite(s): Satisfaction of the Entry Level Writing and Composition requirements. AM 30, and AM 114 or AM 214, and STAT 131 or CSE 107, or by permission of the instructor. Enrollment is restricted to juniors and seniors; graduate students may apply by permission of the instructor.",
        "quarteroffered": "Quarter Offered Winter",
        "fulldesc": "AM 170A Mathematical Modeling 1\nIntroduction to mathematical modeling emphasizing model construction, tool selection, methods of solution, critical analysis of the results, and professional-level presentation of the results (written and oral). Focuses on problems that can be solved using only analytical tools, and simple Matlab routines. Applications are drawn from a variety of fields such as physics, biology, engineering, and economics.\nCredits 5\nInstructor Pascale Garaud\nRequirements Prerequisite(s): Satisfaction of the Entry Level Writing and Composition requirements. AM 30, and AM 114 or AM 214, and STAT 131 or CSE 107, or by permission of the instructor. Enrollment is restricted to juniors and seniors; graduate students may apply by permission of the instructor.\nQuarter Offered Winter\n"
    },
    {
        "coursename": "AM 170B Mathematical Modeling 2",
        "description": "Second course in mathematical modeling emphasizing the general process of scientific inquiry: model construction, tool selection, numerical methods of solution, critical analysis of the results, and professional-level presentation of the results (written and oral). Focuses on problems that must be solved using numerical tools. Applications are drawn from a variety of fields.",
        "genEd": "General Education Code SI",
        "credithours": "Credits 5",
        "instructor": "none",
        "extrarequirements": "Requirements Prerequisites: AM 129 or AM 209, AM 147, and AM 170A. AM 170A may be taken concurrently with 170B on an exceptional basis by permission of the instructor. Enrollment is restricted to seniors. Graduate students may apply with permission of the instructor.",
        "quarteroffered": "Quarter Offered Spring",
        "fulldesc": "AM 170B Mathematical Modeling 2\nSecond course in mathematical modeling emphasizing the general process of scientific inquiry: model construction, tool selection, numerical methods of solution, critical analysis of the results, and professional-level presentation of the results (written and oral). Focuses on problems that must be solved using numerical tools. Applications are drawn from a variety of fields.\nCredits 5\nRequirements Prerequisites: AM 129 or AM 209, AM 147, and AM 170A. AM 170A may be taken concurrently with 170B on an exceptional basis by permission of the instructor. Enrollment is restricted to seniors. Graduate students may apply with permission of the instructor.\nGeneral Education Code SI\nQuarter Offered Spring\n"
    },
    {
        "coursename": "AM 198 Independent Study or Research",
        "description": "Students submit petition to sponsoring agency.",
        "genEd": "none",
        "credithours": "Credits 5",
        "instructor": "Instructor Vanessa Jonsson",
        "extrarequirements": "Repeatable For Credit Yes",
        "quarteroffered": "Quarter Offered Fall, Winter, Spring",
        "fulldesc": "AM 198 Independent Study or Research\nStudents submit petition to sponsoring agency.\nCredits 5\nInstructor Vanessa Jonsson\nRepeatable For Credit Yes\nQuarter Offered Fall, Winter, Spring\n"
    },
    {
        "coursename": "AM 198F Independent Study or Research",
        "description": "Students submit petition to sponsoring agency.",
        "genEd": "none",
        "credithours": "Credits 2",
        "instructor": "none",
        "extrarequirements": "Repeatable For Credit Yes",
        "quarteroffered": "Quarter Offered Fall, Winter, Spring",
        "fulldesc": "AM 198F Independent Study or Research\nStudents submit petition to sponsoring agency.\nCredits 2\nRepeatable For Credit Yes\nQuarter Offered Fall, Winter, Spring\n"
    },
    {
        "coursename": "AM 200 Research and Teaching in Applied Mathematics",
        "description": "Basic teaching techniques for teaching assistants, including responsibilities and rights; resource materials; computer skills; leading discussions or lab sessions; presentation techniques; maintaining class records; and grading. Examines research and professional training, including use of library; technical writing; giving talks in seminars and conferences; and ethical issues in science and engineering. (Formerly AMS 200.)",
        "genEd": "none",
        "credithours": "Credits 3",
        "instructor": "Instructor The Staff, Athanasios Kottas, Pascale Garaud",
        "extrarequirements": "Requirements Enrollment is restricted to graduate students.",
        "quarteroffered": "none",
        "fulldesc": "AM 200 Research and Teaching in Applied Mathematics\nBasic teaching techniques for teaching assistants, including responsibilities and rights; resource materials; computer skills; leading discussions or lab sessions; presentation techniques; maintaining class records; and grading. Examines research and professional training, including use of library; technical writing; giving talks in seminars and conferences; and ethical issues in science and engineering. (Formerly AMS 200.)\nCredits 3\nInstructor The Staff, Athanasios Kottas, Pascale Garaud\nRequirements Enrollment is restricted to graduate students.\n"
    },
    {
        "coursename": "AM 211 Foundations of Applied Mathematics",
        "description": "Accelerated class reviewing fundamental applied mathematical methods for all sciences. Topics include: multivariate calculus, linear algebra, Fourier series and integral transform methods, complex analysis, and ordinary differential equations. (Formerly AMS 211.)",
        "genEd": "none",
        "credithours": "Credits 5",
        "instructor": "Instructor Marcella Gomez, Hongyun Wang, Yonatan Katznelson, Nicholas Brummell",
        "extrarequirements": "Requirements Enrollment is restricted to graduate students.",
        "quarteroffered": "none",
        "fulldesc": "AM 211 Foundations of Applied Mathematics\nAccelerated class reviewing fundamental applied mathematical methods for all sciences. Topics include: multivariate calculus, linear algebra, Fourier series and integral transform methods, complex analysis, and ordinary differential equations. (Formerly AMS 211.)\nCredits 5\nInstructor Marcella Gomez, Hongyun Wang, Yonatan Katznelson, Nicholas Brummell\nRequirements Enrollment is restricted to graduate students.\n"
    },
    {
        "coursename": "AM 212A Applied Partial Differential Equations",
        "description": "Focuses on analytical methods for partial differential equations (PDEs), including: the method of characteristics for first-order PDEs; canonical forms of linear second-order PDEs; separation of variables; Sturm-Liouville theory; Green's functions. Illustrates each method using applications taken from examples in physics. AM 211 or equivalent is strongly recommended as preparation. Students cannot receive credit for this course and AM 112. (Formerly AMS 211, Applied Mathematical Methods I.)",
        "genEd": "none",
        "credithours": "Credits 5",
        "instructor": "Instructor The Staff, Hongyun Wang, Pascale Garaud, Nicholas Brummell, Marcella Gomez",
        "extrarequirements": "Requirements Enrollment is restricted to graduate students; undergraduates are encouraged to take this class with permission of instructor.",
        "quarteroffered": "Quarter Offered Winter",
        "fulldesc": "AM 212A Applied Partial Differential Equations\nFocuses on analytical methods for partial differential equations (PDEs), including: the method of characteristics for first-order PDEs; canonical forms of linear second-order PDEs; separation of variables; Sturm-Liouville theory; Green's functions. Illustrates each method using applications taken from examples in physics. AM 211 or equivalent is strongly recommended as preparation. Students cannot receive credit for this course and AM 112. (Formerly AMS 211, Applied Mathematical Methods I.)\nCredits 5\nInstructor The Staff, Hongyun Wang, Pascale Garaud, Nicholas Brummell, Marcella Gomez\nRequirements Enrollment is restricted to graduate students; undergraduates are encouraged to take this class with permission of instructor.\nQuarter Offered Winter\n"
    },
    {
        "coursename": "AM 212B Applied Mathematical Methods II",
        "description": "Covers perturbation methods: asymptotic series, stationary phase and expansion of integrals, matched asymptotic expansions, multiple scales and the WKB method, Pad approximants and improvements of series. (Formerly AMS 212B.)",
        "genEd": "none",
        "credithours": "Credits 5",
        "instructor": "Instructor The Staff, Hongyun Wang, Pascale Garaud, Nicholas Brummell",
        "extrarequirements": "Requirements Prerequisite(s): Enrollment is restricted to graduate students. Undergraduates may enroll by permission of the instructor.",
        "quarteroffered": "none",
        "fulldesc": "AM 212B Applied Mathematical Methods II\nCovers perturbation methods: asymptotic series, stationary phase and expansion of integrals, matched asymptotic expansions, multiple scales and the WKB method, Pad approximants and improvements of series. (Formerly AMS 212B.)\nCredits 5\nInstructor The Staff, Hongyun Wang, Pascale Garaud, Nicholas Brummell\nRequirements Prerequisite(s): Enrollment is restricted to graduate students. Undergraduates may enroll by permission of the instructor.\n"
    },
    {
        "coursename": "AM 213A Numerical Linear Algebra",
        "description": "Focuses on numerical solutions to classic problems of linear algebra. Topics include: LU, Cholesky, and QR factorizations; iterative methods for linear equations; least square, power methods, and QR algorithms for eigenvalue problems; and conditioning and stability of numerical algorithms. Provides hands-on experience in implementing numerical algorithms for solving engineering and scientific problems. Basic knowledge of mathematical linear algebra is assumed. (Formerly AMS 213A.)",
        "genEd": "none",
        "credithours": "Credits 5",
        "instructor": "Instructor The Staff, Pascale Garaud, Qi Gong, Dongwook Lee",
        "extrarequirements": "Requirements Enrollment is restricted to graduate students. Undergraduate students may enroll with permission of the instructor.",
        "quarteroffered": "Quarter Offered Winter",
        "fulldesc": "AM 213A Numerical Linear Algebra\nFocuses on numerical solutions to classic problems of linear algebra. Topics include: LU, Cholesky, and QR factorizations; iterative methods for linear equations; least square, power methods, and QR algorithms for eigenvalue problems; and conditioning and stability of numerical algorithms. Provides hands-on experience in implementing numerical algorithms for solving engineering and scientific problems. Basic knowledge of mathematical linear algebra is assumed. (Formerly AMS 213A.)\nCredits 5\nInstructor The Staff, Pascale Garaud, Qi Gong, Dongwook Lee\nRequirements Enrollment is restricted to graduate students. Undergraduate students may enroll with permission of the instructor.\nQuarter Offered Winter\n"
    },
    {
        "coursename": "AM 213B Numerical Methods for the Solution of Differential Equations",
        "description": "Introduces the numerical solutions of ordinary and partial differential equations (ODEs and PDEs). Focuses on the derivation of discrete solution methods for a variety of differential equations, and their stability and convergence. Also provides hands-on experience in implementing such numerical algorithms for the solution of engineering and scientific problems using MATLAB software. The class consists of lectures and hands-on programming sections. Basic mathematical knowledge of ODEs and PDEs is assumed, and a basic working knowledge of programming in MATLAB is expected. (Formerly AMS 213B.)",
        "genEd": "none",
        "credithours": "Credits 5",
        "instructor": "Instructor The Staff, Hongyun Wang, Dongwook Lee, Daniele Venturi",
        "extrarequirements": "Requirements Enrollment is restricted to graduate students.",
        "quarteroffered": "Quarter Offered Spring",
        "fulldesc": "AM 213B Numerical Methods for the Solution of Differential Equations\nIntroduces the numerical solutions of ordinary and partial differential equations (ODEs and PDEs). Focuses on the derivation of discrete solution methods for a variety of differential equations, and their stability and convergence. Also provides hands-on experience in implementing such numerical algorithms for the solution of engineering and scientific problems using MATLAB software. The class consists of lectures and hands-on programming sections. Basic mathematical knowledge of ODEs and PDEs is assumed, and a basic working knowledge of programming in MATLAB is expected. (Formerly AMS 213B.)\nCredits 5\nInstructor The Staff, Hongyun Wang, Dongwook Lee, Daniele Venturi\nRequirements Enrollment is restricted to graduate students.\nQuarter Offered Spring\n"
    },
    {
        "coursename": "AM 214 Applied Dynamical Systems",
        "description": "Introduces continuous and discrete dynamical systems. Topics include: fixed points; stability; limit cycles; bifurcations; transition to and characterization of chaos; and fractals. Examples drawn from sciences and engineering; founding papers of the subject are studied. Students cannot receive credit for this course and AM 114 or MATH 145. (Formerly AMS 214.)",
        "genEd": "none",
        "credithours": "Credits 5",
        "instructor": "Instructor The Staff, Pascale Garaud, Qi Gong, Dejan Milutinovic, Daniele Venturi",
        "extrarequirements": "Requirements Enrollment is restricted to graduate students; undergraduates may enroll by permission of instructor.",
        "quarteroffered": "Quarter Offered Fall",
        "fulldesc": "AM 214 Applied Dynamical Systems\nIntroduces continuous and discrete dynamical systems. Topics include: fixed points; stability; limit cycles; bifurcations; transition to and characterization of chaos; and fractals. Examples drawn from sciences and engineering; founding papers of the subject are studied. Students cannot receive credit for this course and AM 114 or MATH 145. (Formerly AMS 214.)\nCredits 5\nInstructor The Staff, Pascale Garaud, Qi Gong, Dejan Milutinovic, Daniele Venturi\nRequirements Enrollment is restricted to graduate students; undergraduates may enroll by permission of instructor.\nQuarter Offered Fall\n"
    },
    {
        "coursename": "AM 215 Stochastic Modeling in Biology",
        "description": "Application of differential equations, probability, and stochastic processes to problems in cell, organismal, and population biology. Topics include systems biology, cellular processes, gene-regulation, and population biology. Students may not receive credit for this course and AM 115. (Formerly AMS 215.)",
        "genEd": "none",
        "credithours": "Credits 5",
        "instructor": "Instructor The Staff, Marcella Gomez",
        "extrarequirements": "Requirements Enrollment is restricted to graduate students; undergraduates may enroll by permission of the instructor.",
        "quarteroffered": "Quarter Offered Spring",
        "fulldesc": "AM 215 Stochastic Modeling in Biology\nApplication of differential equations, probability, and stochastic processes to problems in cell, organismal, and population biology. Topics include systems biology, cellular processes, gene-regulation, and population biology. Students may not receive credit for this course and AM 115. (Formerly AMS 215.)\nCredits 5\nInstructor The Staff, Marcella Gomez\nRequirements Enrollment is restricted to graduate students; undergraduates may enroll by permission of the instructor.\nQuarter Offered Spring\n"
    },
    {
        "coursename": "AM 216 Stochastic Differential Equations",
        "description": "Introduction to stochastic differential equations and diffusion processes with applications to biology, biomolecular engineering, and chemical kinetics. Topics include Brownian motion and white noise, gambler's ruin, backward and forward equations, and the theory of boundary conditions. (Formerly AMS 216.)",
        "genEd": "none",
        "credithours": "Credits 5",
        "instructor": "Instructor The Staff, Hongyun Wang",
        "extrarequirements": "Requirements Enrollment is restricted to graduate students; undergraduates may enroll by permission of the instructor.",
        "quarteroffered": "none",
        "fulldesc": "AM 216 Stochastic Differential Equations\nIntroduction to stochastic differential equations and diffusion processes with applications to biology, biomolecular engineering, and chemical kinetics. Topics include Brownian motion and white noise, gambler's ruin, backward and forward equations, and the theory of boundary conditions. (Formerly AMS 216.)\nCredits 5\nInstructor The Staff, Hongyun Wang\nRequirements Enrollment is restricted to graduate students; undergraduates may enroll by permission of the instructor.\n"
    },
    {
        "coursename": "AM 217 Introduction to Fluid Dynamics",
        "description": "Covers fundamental topics in fluid dynamics at the graduate level: Euler and Lagrange descriptions of continuum dynamics; conservation laws for inviscid and viscous flows; potential flows; exact solutions of the Navier-Stokes equation; boundary layer theory; gravity waves. Students cannot receive credit for this course and AM 107. (Formerly AMS 217.)",
        "genEd": "none",
        "credithours": "Credits 5",
        "instructor": "Instructor The Staff, Nicholas Brummell",
        "extrarequirements": "Requirements Enrollment is restricted to graduate students; undergraduates may enroll by permission of the instructor.",
        "quarteroffered": "Quarter Offered Winter",
        "fulldesc": "AM 217 Introduction to Fluid Dynamics\nCovers fundamental topics in fluid dynamics at the graduate level: Euler and Lagrange descriptions of continuum dynamics; conservation laws for inviscid and viscous flows; potential flows; exact solutions of the Navier-Stokes equation; boundary layer theory; gravity waves. Students cannot receive credit for this course and AM 107. (Formerly AMS 217.)\nCredits 5\nInstructor The Staff, Nicholas Brummell\nRequirements Enrollment is restricted to graduate students; undergraduates may enroll by permission of the instructor.\nQuarter Offered Winter\n"
    },
    {
        "coursename": "AM 227 Waves, Instabilities, and Turbulence in Fluids",
        "description": "Advanced fluid dynamics course introducing various types waves and instabilities that commonly arise in geophysical and astrophysical systems, as well as turbulence. Topics covered include, but are not limited to: pressure waves, gravity waves, convection, shear instabilities, and turbulence. Advanced mathematical methods are used to study each topic. Undergraduates are encouraged to take this course with permission of the instructor. (Formerly Waves and Instabilities in Fluids.)",
        "genEd": "none",
        "credithours": "Credits 5",
        "instructor": "Instructor Pascale Garaud",
        "extrarequirements": "Requirements Prerequisite(s): AM 212A and AM 217.",
        "quarteroffered": "Quarter Offered Winter",
        "fulldesc": "AM 227 Waves, Instabilities, and Turbulence in Fluids\nAdvanced fluid dynamics course introducing various types waves and instabilities that commonly arise in geophysical and astrophysical systems, as well as turbulence. Topics covered include, but are not limited to: pressure waves, gravity waves, convection, shear instabilities, and turbulence. Advanced mathematical methods are used to study each topic. Undergraduates are encouraged to take this course with permission of the instructor. (Formerly Waves and Instabilities in Fluids.)\nCredits 5\nInstructor Pascale Garaud\nRequirements Prerequisite(s): AM 212A and AM 217.\nQuarter Offered Winter\n"
    },
    {
        "coursename": "AM 229 Convex Optimization",
        "description": "Focuses on recognizing, formulating, analyzing, and solving convex optimization problems encountered across science and engineering. Topics include: convex sets; convex functions; convex optimization problems; duality; subgradient calculus; algorithms for smooth and non-smooth convex optimization; applications to signal and image processing, machine learning, statistics, control, robotics and economics. Students are required to have knowledge of calculus and linear algebra, and exposure to probability. (Formerly AMS 229.)",
        "genEd": "none",
        "credithours": "Credits 5",
        "instructor": "Instructor Abhishek Halder",
        "extrarequirements": "Requirements Enrollment is restricted to graduate students.",
        "quarteroffered": "Quarter Offered Fall",
        "fulldesc": "AM 229 Convex Optimization\nFocuses on recognizing, formulating, analyzing, and solving convex optimization problems encountered across science and engineering. Topics include: convex sets; convex functions; convex optimization problems; duality; subgradient calculus; algorithms for smooth and non-smooth convex optimization; applications to signal and image processing, machine learning, statistics, control, robotics and economics. Students are required to have knowledge of calculus and linear algebra, and exposure to probability. (Formerly AMS 229.)\nCredits 5\nInstructor Abhishek Halder\nRequirements Enrollment is restricted to graduate students.\nQuarter Offered Fall\n"
    },
    {
        "coursename": "AM 230 Numerical Optimization",
        "description": "Introduces numerical optimization tools widely used in engineering, science, and economics. Topics include: line-search and trust-region methods for unconstrained optimization, fundamental theory of constrained optimization, simplex and interior-point methods for linear programming, and computational algorithms for nonlinear programming. (Formerly AMS 230.)",
        "genEd": "none",
        "credithours": "Credits 5",
        "instructor": "Instructor Qi Gong",
        "extrarequirements": "Requirements Basic knowledge of linear algebra is assumed. Enrollment is restricted to graduate students. Undergraduates may enroll by permission of the instructor.",
        "quarteroffered": "Quarter Offered Winter",
        "fulldesc": "AM 230 Numerical Optimization\nIntroduces numerical optimization tools widely used in engineering, science, and economics. Topics include: line-search and trust-region methods for unconstrained optimization, fundamental theory of constrained optimization, simplex and interior-point methods for linear programming, and computational algorithms for nonlinear programming. (Formerly AMS 230.)\nCredits 5\nInstructor Qi Gong\nRequirements Basic knowledge of linear algebra is assumed. Enrollment is restricted to graduate students. Undergraduates may enroll by permission of the instructor.\nQuarter Offered Winter\n"
    },
    {
        "coursename": "AM 231 Nonlinear Control Theory",
        "description": "Covers analysis and design of nonlinear control systems using Lyapunov theory and geometric methods. Includes properties of solutions of nonlinear systems, Lyapunov stability analysis, effects of perturbations, controllability, observability, feedback linearization, and nonlinear control design tools for stabilization. (Formerly AMS 231.)",
        "genEd": "none",
        "credithours": "Credits 5",
        "instructor": "Instructor Qi Gong, Abhishek Halder",
        "extrarequirements": "Requirements Prerequisite(s): basic knowledge of mathematical analysis and ordinary differential equations is assumed. Enrollment is restricted to graduate students; undergraduates may enroll by permission of the instructor.",
        "quarteroffered": "none",
        "fulldesc": "AM 231 Nonlinear Control Theory\nCovers analysis and design of nonlinear control systems using Lyapunov theory and geometric methods. Includes properties of solutions of nonlinear systems, Lyapunov stability analysis, effects of perturbations, controllability, observability, feedback linearization, and nonlinear control design tools for stabilization. (Formerly AMS 231.)\nCredits 5\nInstructor Qi Gong, Abhishek Halder\nRequirements Prerequisite(s): basic knowledge of mathematical analysis and ordinary differential equations is assumed. Enrollment is restricted to graduate students; undergraduates may enroll by permission of the instructor.\n"
    },
    {
        "coursename": "AM 232 Applied Optimal Control",
        "description": "Introduces optimal control theory and computational optimal control algorithms. Topics include: calculus of variations, minimum principle, dynamic programming, HJB equation, linear-quadratic regulator, direct and indirect computational methods, and engineering application of optimal control. (Formerly AMS 232.)",
        "genEd": "none",
        "credithours": "Credits 5",
        "instructor": "Instructor Qi Gong, Abhishek Halder",
        "extrarequirements": "Requirements Prerequisite(s): AM 114 or AM 214, or ECE 240 or ECE 241, or MATH 145. Enrollment is restricted to graduate students. Undergraduates may enroll by permission of the instructor.",
        "quarteroffered": "Quarter Offered Spring",
        "fulldesc": "AM 232 Applied Optimal Control\nIntroduces optimal control theory and computational optimal control algorithms. Topics include: calculus of variations, minimum principle, dynamic programming, HJB equation, linear-quadratic regulator, direct and indirect computational methods, and engineering application of optimal control. (Formerly AMS 232.)\nCredits 5\nInstructor Qi Gong, Abhishek Halder\nRequirements Prerequisite(s): AM 114 or AM 214, or ECE 240 or ECE 241, or MATH 145. Enrollment is restricted to graduate students. Undergraduates may enroll by permission of the instructor.\nQuarter Offered Spring\n"
    },
    {
        "coursename": "AM 238 Fundamentals of Uncertainty Quantification in Computational Science and Engineering",
        "description": "Computing the statistical properties of nonlinear random system is of fundamental importance in many areas of science and engineering. Introduces students to state-of-the-art methods for uncertainty propagation and quantification in model-based computations, focusing on the computational and algorithmic features of these methods most useful in dealing with systems specified in terms of stochastic ordinary and partial differential equations. Topics include: polynomial chaos methods (gPC and ME-gPC), probabilistic collocation methods (PCM and ME-PCM), Monte-Carlo methods (MC, quasi-MC, multi-level MC), sparse grids (SG), probability density function methods, and techniques for dimensional reduction. Basic knowledge of probability theory and elementary numerical methods for ODEs and PDEs is recommended. (Formerly AMS 238.)",
        "genEd": "none",
        "credithours": "Credits 5",
        "instructor": "Instructor Daniele Venturi",
        "extrarequirements": "Requirements Prerequisite(s): STAT 203 or equivalent, and AM 213B or equivalent. Enrollment is restricted to graduate students.",
        "quarteroffered": "Quarter Offered Fall",
        "fulldesc": "AM 238 Fundamentals of Uncertainty Quantification in Computational Science and Engineering\nComputing the statistical properties of nonlinear random system is of fundamental importance in many areas of science and engineering. Introduces students to state-of-the-art methods for uncertainty propagation and quantification in model-based computations, focusing on the computational and algorithmic features of these methods most useful in dealing with systems specified in terms of stochastic ordinary and partial differential equations. Topics include: polynomial chaos methods (gPC and ME-gPC), probabilistic collocation methods (PCM and ME-PCM), Monte-Carlo methods (MC, quasi-MC, multi-level MC), sparse grids (SG), probability density function methods, and techniques for dimensional reduction. Basic knowledge of probability theory and elementary numerical methods for ODEs and PDEs is recommended. (Formerly AMS 238.)\nCredits 5\nInstructor Daniele Venturi\nRequirements Prerequisite(s): STAT 203 or equivalent, and AM 213B or equivalent. Enrollment is restricted to graduate students.\nQuarter Offered Fall\n"
    },
    {
        "coursename": "AM 250 An Introduction to High Performance Computing",
        "description": "Designed for STEM students and others. Through hands-on practice, this course introduces high-performance parallel computing, including the concepts of multiprocessor machines and parallel computation, and the hardware and software tools associated with them. Students become familiar with parallel concepts and the use of MPI and OpenMP together with some insight into the use of heterogeneous architectures (CPU, CUDA, OpenCL), and some case-study problems. (Formerly AMS 250.)",
        "genEd": "none",
        "credithours": "Credits 5",
        "instructor": "Instructor The Staff, Dongwook Lee, Nicholas Brummell",
        "extrarequirements": "Requirements Enrollment is restricted to graduate students; undergraduates may enroll by permission of the instructor.",
        "quarteroffered": "Quarter Offered Spring",
        "fulldesc": "AM 250 An Introduction to High Performance Computing\nDesigned for STEM students and others. Through hands-on practice, this course introduces high-performance parallel computing, including the concepts of multiprocessor machines and parallel computation, and the hardware and software tools associated with them. Students become familiar with parallel concepts and the use of MPI and OpenMP together with some insight into the use of heterogeneous architectures (CPU, CUDA, OpenCL), and some case-study problems. (Formerly AMS 250.)\nCredits 5\nInstructor The Staff, Dongwook Lee, Nicholas Brummell\nRequirements Enrollment is restricted to graduate students; undergraduates may enroll by permission of the instructor.\nQuarter Offered Spring\n"
    },
    {
        "coursename": "AM 260 Computational Fluid Dynamics",
        "description": "Introduces modern computational approaches to solving the differential equations that arise in fluid dynamics, particularly for problems involving discontinuities and shock waves. Examines the fundamentals of the mathematical foundations and computation methods to obtain solutions. Focuses on writing practical numerical codes and analyzing their results for a full understanding of fluid phenomena. (Formerly AMS 260.)",
        "genEd": "none",
        "credithours": "Credits 5",
        "instructor": "Instructor The Staff, Nicholas Brummell, Dongwook Lee",
        "extrarequirements": "Requirements Prerequisite(s): Basic knowledge of computer programming languages is assumed. Enrollment is restricted to graduate students.",
        "quarteroffered": "Quarter Offered Spring",
        "fulldesc": "AM 260 Computational Fluid Dynamics\nIntroduces modern computational approaches to solving the differential equations that arise in fluid dynamics, particularly for problems involving discontinuities and shock waves. Examines the fundamentals of the mathematical foundations and computation methods to obtain solutions. Focuses on writing practical numerical codes and analyzing their results for a full understanding of fluid phenomena. (Formerly AMS 260.)\nCredits 5\nInstructor The Staff, Nicholas Brummell, Dongwook Lee\nRequirements Prerequisite(s): Basic knowledge of computer programming languages is assumed. Enrollment is restricted to graduate students.\nQuarter Offered Spring\n"
    },
    {
        "coursename": "AM 275 Magnetohydrodynamics",
        "description": "Studies the interaction of fluid motion and magnetic fields in electrically conducting fluids, with applications in many natural and man-made flows ranging from, for example, planetary physics and astrophysics to industrial metallurgic engineering. (Formerly AMS 275.)",
        "genEd": "none",
        "credithours": "Credits 5",
        "instructor": "Instructor Pascale Garaud, Nicholas Brummell",
        "extrarequirements": "Requirements Prerequisite(s): AM 107 or AM 217. AM 227 suggested. Enrollment is restricted to graduate students.",
        "quarteroffered": "none",
        "fulldesc": "AM 275 Magnetohydrodynamics\nStudies the interaction of fluid motion and magnetic fields in electrically conducting fluids, with applications in many natural and man-made flows ranging from, for example, planetary physics and astrophysics to industrial metallurgic engineering. (Formerly AMS 275.)\nCredits 5\nCross Listed Courses EART 275\nInstructor Pascale Garaud, Nicholas Brummell\nRequirements Prerequisite(s): AM 107 or AM 217. AM 227 suggested. Enrollment is restricted to graduate students.\n"
    },
    {
        "coursename": "AM 280A Seminar in Mathematical and Computational Biology",
        "description": "Weekly seminar on mathematical and computational biology. Participants present research findings in organized and critical fashion, framed in context of current literature. Students present own research on a regular basis. (Formerly AMS 280A.)",
        "genEd": "none",
        "credithours": "Credits 2",
        "instructor": "Instructor Hongyun Wang",
        "extrarequirements": "Repeatable For Credit Yes",
        "quarteroffered": "Quarter Offered Spring",
        "fulldesc": "AM 280A Seminar in Mathematical and Computational Biology\nWeekly seminar on mathematical and computational biology. Participants present research findings in organized and critical fashion, framed in context of current literature. Students present own research on a regular basis. (Formerly AMS 280A.)\nCredits 2\nInstructor Hongyun Wang\nRequirements Enrollment is restricted to graduate students.\nRepeatable For Credit Yes\nQuarter Offered Spring\n"
    },
    {
        "coursename": "AM 280B Seminar in Applied Mathematical Modeling",
        "description": "Weekly seminar series covering topics of current research in applied mathematics and statistics. Permission of instructor required. Enrollment is restricted to graduate students. (Formerly AMS 280B.)",
        "genEd": "none",
        "credithours": "Credits 2",
        "instructor": "Instructor Abhishek Halder, Marchella Gomez",
        "extrarequirements": "Repeatable For Credit Yes",
        "quarteroffered": "Quarter Offered Fall, Winter, Spring",
        "fulldesc": "AM 280B Seminar in Applied Mathematical Modeling\nWeekly seminar series covering topics of current research in applied mathematics and statistics. Permission of instructor required. Enrollment is restricted to graduate students. (Formerly AMS 280B.)\nCredits 2\nInstructor Abhishek Halder, Marchella Gomez\nRepeatable For Credit Yes\nQuarter Offered Fall, Winter, Spring\n"
    },
    {
        "coursename": "AM 280C Seminar in Geophysical and Astrophysical Fluid Dynamics",
        "description": "Weekly seminar/discussion group on geophysical and astrophysical fluid dynamics covering both analytical and computational approaches. Participants present research progress and findings in semiformal discussions. Students must present their own research on a regular basis. (Formerly AMS 280C.)",
        "genEd": "none",
        "credithours": "Credits 2",
        "instructor": "Instructor Dongwook Lee, Pascale Garaud, Nicholas Brummell",
        "extrarequirements": "Repeatable For Credit Yes",
        "quarteroffered": "Quarter Offered Fall, Winter, Spring",
        "fulldesc": "AM 280C Seminar in Geophysical and Astrophysical Fluid Dynamics\nWeekly seminar/discussion group on geophysical and astrophysical fluid dynamics covering both analytical and computational approaches. Participants present research progress and findings in semiformal discussions. Students must present their own research on a regular basis. (Formerly AMS 280C.)\nCredits 2\nInstructor Dongwook Lee, Pascale Garaud, Nicholas Brummell\nRequirements Enrollment is restricted to graduate students; undergraduates may enroll by permission of the instructor.\nRepeatable For Credit Yes\nQuarter Offered Fall, Winter, Spring\n"
    },
    {
        "coursename": "AM 296 Masters Project",
        "description": "Independent completion of a masters project under faculty supervision. Students submit petition to sponsoring agency. Enrollment is restricted to graduate students.",
        "genEd": "none",
        "credithours": "Credits 2",
        "instructor": "none",
        "extrarequirements": "Repeatable For Credit Yes",
        "quarteroffered": "Quarter Offered Fall, Winter, Spring",
        "fulldesc": "AM 296 Masters Project\nIndependent completion of a masters project under faculty supervision. Students submit petition to sponsoring agency. Enrollment is restricted to graduate students.\nCredits 2\nRepeatable For Credit Yes\nQuarter Offered Fall, Winter, Spring\n"
    },
    {
        "coursename": "AM 297A Independent Study or Research",
        "description": "Independent study or research under faculty supervision. Students submit petition to sponsoring agency. Enrollment is restricted to graduate students.",
        "genEd": "none",
        "credithours": "Credits 5",
        "instructor": "none",
        "extrarequirements": "Repeatable For Credit Yes",
        "quarteroffered": "Quarter Offered Fall, Winter, Spring",
        "fulldesc": "AM 297A Independent Study or Research\nIndependent study or research under faculty supervision. Students submit petition to sponsoring agency. Enrollment is restricted to graduate students.\nCredits 5\nRepeatable For Credit Yes\nQuarter Offered Fall, Winter, Spring\n"
    },
    {
        "coursename": "AM 297B Independent Study or Research",
        "description": "Independent study or research under faculty supervision. Students submit petition to sponsoring agency. Enrollment is restricted to graduate students.",
        "genEd": "none",
        "credithours": "Credits 10",
        "instructor": "none",
        "extrarequirements": "Repeatable For Credit Yes",
        "quarteroffered": "none",
        "fulldesc": "AM 297B Independent Study or Research\nIndependent study or research under faculty supervision. Students submit petition to sponsoring agency. Enrollment is restricted to graduate students.\nCredits 10\nRepeatable For Credit Yes\n"
    },
    {
        "coursename": "AM 297C Independent Study or Research",
        "description": "Independent study or research under faculty supervision. Students submit petition to sponsoring agency. Enrollment is restricted to graduate students.",
        "genEd": "none",
        "credithours": "Credits 15",
        "instructor": "none",
        "extrarequirements": "Repeatable For Credit Yes",
        "quarteroffered": "none",
        "fulldesc": "AM 297C Independent Study or Research\nIndependent study or research under faculty supervision. Students submit petition to sponsoring agency. Enrollment is restricted to graduate students.\nCredits 15\nRepeatable For Credit Yes\n"
    },
    {
        "coursename": "AM 297F Independent Study",
        "description": "Independent study or research under faculty supervision. Students submit petition to sponsoring agency. Enrollment is restricted to graduate students.",
        "genEd": "none",
        "credithours": "Credits 2",
        "instructor": "none",
        "extrarequirements": "Repeatable For Credit Yes",
        "quarteroffered": "Quarter Offered Fall, Winter, Spring",
        "fulldesc": "AM 297F Independent Study\nIndependent study or research under faculty supervision. Students submit petition to sponsoring agency. Enrollment is restricted to graduate students.\nCredits 2\nRepeatable For Credit Yes\nQuarter Offered Fall, Winter, Spring\n"
    },
    {
        "coursename": "AM 299A Thesis Research",
        "description": "Thesis research under faculty supervision. Students submit petition to sponsoring agency. Enrollment restricted to graduate students.",
        "genEd": "none",
        "credithours": "Credits 5",
        "instructor": "none",
        "extrarequirements": "Repeatable For Credit Yes",
        "quarteroffered": "none",
        "fulldesc": "AM 299A Thesis Research\nThesis research under faculty supervision. Students submit petition to sponsoring agency. Enrollment restricted to graduate students.\nCredits 5\nRepeatable For Credit Yes\n"
    },
    {
        "coursename": "AM 299B Thesis Research",
        "description": "Thesis research under faculty supervision. Students submit petition to sponsoring agency. Enrollment restricted to graduate students.",
        "genEd": "none",
        "credithours": "Credits 10",
        "instructor": "none",
        "extrarequirements": "Repeatable For Credit Yes",
        "quarteroffered": "none",
        "fulldesc": "AM 299B Thesis Research\nThesis research under faculty supervision. Students submit petition to sponsoring agency. Enrollment restricted to graduate students.\nCredits 10\nRepeatable For Credit Yes\n"
    },
    {
        "coursename": "AM 299C Thesis Research",
        "description": "Thesis research under faculty supervision. Students submit petition to sponsoring agency. Enrollment restricted to graduate students.",
        "genEd": "none",
        "credithours": "Credits 15",
        "instructor": "none",
        "extrarequirements": "Repeatable For Credit Yes",
        "quarteroffered": "none",
        "fulldesc": "AM 299C Thesis Research\nThesis research under faculty supervision. Students submit petition to sponsoring agency. Enrollment restricted to graduate students.\nCredits 15\nRepeatable For Credit Yes\n"
    }
]