[
    {
        "coursename": "ARTG 80G Visual Communication and Interaction Design",
        "description": "Survey of the basics of visual communication and interaction design, focusing on communicating designs of interactive systems. Covers techniques from a breadth of visual communication traditions; how to choose, use, and innovate; and how to structure dialogue around them.",
        "genEd": "General Education Code IM",
        "credithours": "Credits 5",
        "instructor": "none",
        "extrarequirements": "none",
        "quarteroffered": "Quarter Offered Fall",
        "fulldesc": "ARTG 80G Visual Communication and Interaction Design\nSurvey of the basics of visual communication and interaction design, focusing on communicating designs of interactive systems. Covers techniques from a breadth of visual communication traditions; how to choose, use, and innovate; and how to structure dialogue around them.\nCredits 5\nGeneral Education Code IM\nQuarter Offered Fall\n"
    },
    {
        "coursename": "ARTG 80H Critical History of Digital Games",
        "description": "Surveys the history of digital games from open university games through the home console, PC, and contemporary platforms, and on to indie and art games. Throughout, the course locates connections between technology, marketing, and play culture. (Formerly History of Digital Games.)",
        "genEd": "General Education Code PE-T",
        "credithours": "Credits 5",
        "instructor": "Instructor The Staff",
        "extrarequirements": "none",
        "quarteroffered": "Quarter Offered Fall, Winter",
        "fulldesc": "ARTG 80H Critical History of Digital Games\nSurveys the history of digital games from open university games through the home console, PC, and contemporary platforms, and on to indie and art games. Throughout, the course locates connections between technology, marketing, and play culture. (Formerly History of Digital Games.)\nCredits 5\nInstructor The Staff\nGeneral Education Code PE-T\nQuarter Offered Fall, Winter\n"
    },
    {
        "coursename": "ARTG 80I Foundations of Play",
        "description": "Understanding the foundations of play through reading influential texts; in-class lectures and activities; designing and playtesting games; and the ethnographies of players in the physical world.",
        "genEd": "General Education Code PE-H",
        "credithours": "Credits 5",
        "instructor": "Instructor The Staff",
        "extrarequirements": "none",
        "quarteroffered": "Quarter Offered Fall, Spring, Summer",
        "fulldesc": "ARTG 80I Foundations of Play\nUnderstanding the foundations of play through reading influential texts; in-class lectures and activities; designing and playtesting games; and the ethnographies of players in the physical world.\nCredits 5\nInstructor The Staff\nGeneral Education Code PE-H\nQuarter Offered Fall, Spring, Summer\n"
    },
    {
        "coursename": "ARTG 91 Introduction to Game Art Production",
        "description": "Project-centered studio-lecture hybrid course that introduces the process of world-building and interaction design from the standpoint of the art director. Each project addresses a milestone in the art direction development pipeline, and demonstrates corresponding entry-level technical and conceptual skills and strategies. Utilizing this split methodology, the big-picture game development process is presented in tandem with related fundamental digital art and design skills at an achievable scale for an introductory course.",
        "genEd": "General Education Code PR-C",
        "credithours": "Credits 5",
        "instructor": "Instructor The Staff",
        "extrarequirements": "none",
        "quarteroffered": "Quarter Offered Winter",
        "fulldesc": "ARTG 91 Introduction to Game Art Production\nProject-centered studio-lecture hybrid course that introduces the process of world-building and interaction design from the standpoint of the art director. Each project addresses a milestone in the art direction development pipeline, and demonstrates corresponding entry-level technical and conceptual skills and strategies. Utilizing this split methodology, the big-picture game development process is presented in tandem with related fundamental digital art and design skills at an achievable scale for an introductory course.\nCredits 5\nInstructor The Staff\nGeneral Education Code PR-C\nQuarter Offered Winter\n"
    },
    {
        "coursename": "ARTG 118 Character Creation for Video Games",
        "description": "This is a hands-on studio course, intended to give students an understanding of the techniques used to create characters for use in video games. Through this course, students will understand and develop the skills necessary to take a video game character design through all of the stages necessary to have a finished character for use in 2D or 3D video games. You will learn industry tools and techniques to be an effective game artist. (Formerly, Digital Drawing/Painting for Game Design.)",
        "genEd": "General Education Code PR-C",
        "credithours": "Credits 5",
        "instructor": "Instructor The Staff",
        "extrarequirements": "Repeatable For Credit Yes",
        "quarteroffered": "none",
        "fulldesc": "ARTG 118 Character Creation for Video Games\nThis is a hands-on studio course, intended to give students an understanding of the techniques used to create characters for use in video games. Through this course, students will understand and develop the skills necessary to take a video game character design through all of the stages necessary to have a finished character for use in 2D or 3D video games. You will learn industry tools and techniques to be an effective game artist. (Formerly, Digital Drawing/Painting for Game Design.)\nCredits 5\nInstructor The Staff\nRequirements Enrollment is restricted to junior and senior art and design: games and playable media majors and proposed majors.\nRepeatable For Credit Yes\nGeneral Education Code PR-C\n"
    },
    {
        "coursename": "ARTG 120 Game Design Experience",
        "description": "Corequisites Concurrent enrollment in CMPM 120 is required.",
        "genEd": "General Education Code PR-E",
        "credithours": "Credits 5",
        "instructor": "Instructor The Staff",
        "extrarequirements": "Requirements Prerequisite(s): ARTG 80G or ARTG 80H or ARTG 80I; and CMPM 80K; and FILM 80V; and CSE 30 or CSE 15 and CSE 15L or CMPM 35. Concurrent enrollment in CMPM 120 is required. Enrollment is restricted to juniors and seniors.",
        "quarteroffered": "Quarter Offered Spring",
        "fulldesc": "ARTG 120 Game Design Experience\nTeaches the concrete skills associated with making a digital game, from start to finish. Activities include establishing a team, concepting, storyboarding, prototyping, producing, and testing a game for release. Students are organized into groups and work together to create and produce a playable game.\nCredits 5\nCorequisites Concurrent enrollment in CMPM 120 is required.\nInstructor The Staff\nRequirements Prerequisite(s): ARTG 80G or ARTG 80H or ARTG 80I; and CMPM 80K; and FILM 80V; and CSE 30 or CSE 15 and CSE 15L or CMPM 35. Concurrent enrollment in CMPM 120 is required. Enrollment is restricted to juniors and seniors.\nGeneral Education Code PR-E\nQuarter Offered Spring\n"
    },
    {
        "coursename": "ARTG 129 Special Topics in Game Design",
        "description": "Allows students to explore game designs related to their ongoing work within their major in either digital or non-digital formats. Students choose a topic and develop game projects that engage players.",
        "genEd": "none",
        "credithours": "Credits 5",
        "instructor": "Instructor The Staff",
        "extrarequirements": "Repeatable For Credit Yes",
        "quarteroffered": "none",
        "fulldesc": "ARTG 129 Special Topics in Game Design\nAllows students to explore game designs related to their ongoing work within their major in either digital or non-digital formats. Students choose a topic and develop game projects that engage players.\nCredits 5\nInstructor The Staff\nRequirements Prerequisite(s): Two of the following courses: ARTG 80G, ARTG 80H, ARTG 80I. Enrollment is restricted to art & design: games and playable media and computer science:computer game design majors.\nRepeatable For Credit Yes\n"
    },
    {
        "coursename": "ARTG 129A Special Topics in Game Design",
        "description": "Gives students an opportunity to explore game designs related to their ongoing work within the AGPM major, in either digital or analog formats. Students develop projects that engage players on a topic of their choosing.",
        "genEd": "none",
        "credithours": "Credits 5",
        "instructor": "Instructor The Staff",
        "extrarequirements": "Repeatable For Credit Yes",
        "quarteroffered": "none",
        "fulldesc": "ARTG 129A Special Topics in Game Design\nGives students an opportunity to explore game designs related to their ongoing work within the AGPM major, in either digital or analog formats. Students develop projects that engage players on a topic of their choosing.\nCredits 5\nInstructor The Staff\nRequirements Prerequisite(s): ARTG 80G, ARTG 80H, and ARTG 80I. Enrollment is restricted to art and design: games and playable media and computer science: games and playable media majors.\nRepeatable For Credit Yes\n"
    },
    {
        "coursename": "ARTG 131 3D Game Art Production",
        "description": "Studio course in which students learn the highly technical and fundamental skills in the production of 3D art assets for video games. Covers the essential steps in the 3D art pipeline, starting with basic 3D modeling, UV unwrapping, the creation of texture maps, and finally, game engine implementation. Focuses on developing an understanding of the processes and creative thinking necessary to produce industry-level artwork rather than specific software. Students provided with video lectures and demos, and students can expect to produce weekly assignments to practice basic skills and concepts covered.",
        "genEd": "none",
        "credithours": "Credits 5",
        "instructor": "Instructor The Staff",
        "extrarequirements": "Repeatable For Credit Yes",
        "quarteroffered": "Quarter Offered Fall",
        "fulldesc": "ARTG 131 3D Game Art Production\nStudio course in which students learn the highly technical and fundamental skills in the production of 3D art assets for video games. Covers the essential steps in the 3D art pipeline, starting with basic 3D modeling, UV unwrapping, the creation of texture maps, and finally, game engine implementation. Focuses on developing an understanding of the processes and creative thinking necessary to produce industry-level artwork rather than specific software. Students provided with video lectures and demos, and students can expect to produce weekly assignments to practice basic skills and concepts covered.\nCredits 5\nInstructor The Staff\nRepeatable For Credit Yes\nQuarter Offered Fall\n"
    },
    {
        "coursename": "ARTG 132 3D Character Rigging and Animation for Video Games",
        "description": "Gives students an in-depth understanding of the techniques of 3D character rigging and animation for video games. Students understand and develop the skills necessary to be an effective technical artist and animator with a focus on industry standard methods for animating characters to be implemented into a game engine. Course provides students with video and written lectures, video demonstrations, assignments and discussion boards aimed at giving them historical understanding of game animation, the evolution of these techniques, hands-on work to become proficient, as well as the ability to communicate online with other students and the instructor to answer questions and further their knowledge.",
        "genEd": "General Education Code PR-C",
        "credithours": "Credits 5",
        "instructor": "Instructor The Staff",
        "extrarequirements": "Repeatable For Credit Yes",
        "quarteroffered": "Quarter Offered Spring",
        "fulldesc": "ARTG 132 3D Character Rigging and Animation for Video Games\nGives students an in-depth understanding of the techniques of 3D character rigging and animation for video games. Students understand and develop the skills necessary to be an effective technical artist and animator with a focus on industry standard methods for animating characters to be implemented into a game engine. Course provides students with video and written lectures, video demonstrations, assignments and discussion boards aimed at giving them historical understanding of game animation, the evolution of these techniques, hands-on work to become proficient, as well as the ability to communicate online with other students and the instructor to answer questions and further their knowledge.\nCredits 5\nInstructor The Staff\nRepeatable For Credit Yes\nGeneral Education Code PR-C\nQuarter Offered Spring\n"
    },
    {
        "coursename": "ARTG 134 Spectacular Play: Performance, Ritual, and Making a Scene IRL",
        "description": "What do immersion and interactivity look like outside of virtual worlds? How can we activate social dynamics and public space for the purpose of play? How might we evoke feelings of purpose, or even magic, for players and spectators alike? Students will study and create immersive experiences designed to play out in real life. Drawing inspiration from performance studies, activism, art history, and more, we will transform the everyday into the extraordinary.",
        "genEd": "General Education Code PR-C",
        "credithours": "Credits 5",
        "instructor": "Instructor The Staff",
        "extrarequirements": "Repeatable For Credit Yes",
        "quarteroffered": "none",
        "fulldesc": "ARTG 134 Spectacular Play: Performance, Ritual, and Making a Scene IRL\nWhat do immersion and interactivity look like outside of virtual worlds? How can we activate social dynamics and public space for the purpose of play? How might we evoke feelings of purpose, or even magic, for players and spectators alike? Students will study and create immersive experiences designed to play out in real life. Drawing inspiration from performance studies, activism, art history, and more, we will transform the everyday into the extraordinary.\nCredits 5\nInstructor The Staff\nRequirements Two of the following courses: ARTG 80G, ARTG 80H, ARTG 80I.\nRepeatable For Credit Yes\nGeneral Education Code PR-C\n"
    },
    {
        "coursename": "ARTG 136 Digital Sculpting for Video Games",
        "description": "In this studio course, students learn the basics of digital sculpting in ZBrush with a focus on 3D character art. Through a mix of in-class demos and periodic assignments, students learn how to produce high-fidelity digital sculpts and their practical application in the 3D game art pipeline.",
        "genEd": "none",
        "credithours": "Credits 5",
        "instructor": "Instructor The Staff",
        "extrarequirements": "Repeatable For Credit Yes",
        "quarteroffered": "none",
        "fulldesc": "ARTG 136 Digital Sculpting for Video Games\nIn this studio course, students learn the basics of digital sculpting in ZBrush with a focus on 3D character art. Through a mix of in-class demos and periodic assignments, students learn how to produce high-fidelity digital sculpts and their practical application in the 3D game art pipeline.\nCredits 5\nInstructor The Staff\nRequirements Prerequisite(s): ARTG 118. Previous 3D modeling experience is encouraged, but not required.\nRepeatable For Credit Yes\n"
    },
    {
        "coursename": "ARTG 137 Experimental Tabletop RPG Design",
        "description": "Explores experimental mechanics, dynamics, themes, and aesthetics within the tabletop RPG form. In groups and individually, students will play, run, design, write, workshop, and print/produce experimental tabletop RPGs, as well as conduct usability tests focused on layout, design cohesion, and accessibility.",
        "genEd": "none",
        "credithours": "Credits 5",
        "instructor": "Instructor The Staff",
        "extrarequirements": "Repeatable For Credit Yes",
        "quarteroffered": "none",
        "fulldesc": "ARTG 137 Experimental Tabletop RPG Design\nExplores experimental mechanics, dynamics, themes, and aesthetics within the tabletop RPG form. In groups and individually, students will play, run, design, write, workshop, and print/produce experimental tabletop RPGs, as well as conduct usability tests focused on layout, design cohesion, and accessibility.\nCredits 5\nInstructor The Staff\nRequirements Prerequisite(s): ARTG 80G, ARTG 80H, and ARTG 80I.\nRepeatable For Credit Yes\n"
    },
    {
        "coursename": "ARTG 138 Feminist Games",
        "description": "Feminist games including intersectional feminist games, transfeminist games and queer feminist games, will be created by students in this course. Students will study the existing history and present of these genres of games, including game mods, personal experience games, narrative games, alternate reality, augmented reality and electronic literature. Students will work individually to create games as art and activism building on critical theories of race, gender, sexuality and algorithms.",
        "genEd": "none",
        "credithours": "Credits 5",
        "instructor": "Instructor The Staff",
        "extrarequirements": "Requirements Prerequisite(s): Two courses from the following: ARTG 80G, ARTG 80H, or ARTG 80I.",
        "quarteroffered": "none",
        "fulldesc": "ARTG 138 Feminist Games\nFeminist games including intersectional feminist games, transfeminist games and queer feminist games, will be created by students in this course. Students will study the existing history and present of these genres of games, including game mods, personal experience games, narrative games, alternate reality, augmented reality and electronic literature. Students will work individually to create games as art and activism building on critical theories of race, gender, sexuality and algorithms.\nCredits 5\nCross Listed Courses FMST 138\nInstructor The Staff\nRequirements Prerequisite(s): Two courses from the following: ARTG 80G, ARTG 80H, or ARTG 80I.\n"
    },
    {
        "coursename": "ARTG 140 Writing for Interactive Narrative",
        "description": "Discusses a variety of aspects of writing found in videogames and other interactive forms of media. Using a mix of creative writing projects and in class discussions, students will practice and critique existing work as well as their own.",
        "genEd": "none",
        "credithours": "Credits 5",
        "instructor": "Instructor The Staff",
        "extrarequirements": "none",
        "quarteroffered": "Quarter Offered Summer",
        "fulldesc": "ARTG 140 Writing for Interactive Narrative\nDiscusses a variety of aspects of writing found in videogames and other interactive forms of media. Using a mix of creative writing projects and in class discussions, students will practice and critique existing work as well as their own.\nCredits 5\nInstructor The Staff\nQuarter Offered Summer\n"
    },
    {
        "coursename": "ARTG 141 Introduction to Virtual Reality",
        "description": "Introduction to Virtual Reality is an introductory course with a combination of theory and practice. Students are exposed to the history of Virtual Reality and hands-on experience in making VR and developing their own VR project. By introducing broad topics around VR, such as immersive spectacle, virtual embodiment, sonic immersiveness, students will gain knowledge about cultural, historical, and practical perspectives of VR. Students will also learn technical skills in developing VR in Unity 3D. 3D modeling experience is not required in this class. This class is an integration of the production of 3D and 360 degree VR experience. Photogrammetry, 360 degree video production and editing, and other expressive media will also be introduced for advancing the development of VR.",
        "genEd": "none",
        "credithours": "Credits 5",
        "instructor": "Instructor The Staff",
        "extrarequirements": "none",
        "quarteroffered": "Quarter Offered Summer",
        "fulldesc": "ARTG 141 Introduction to Virtual Reality\nIntroduction to Virtual Reality is an introductory course with a combination of theory and practice. Students are exposed to the history of Virtual Reality and hands-on experience in making VR and developing their own VR project. By introducing broad topics around VR, such as immersive spectacle, virtual embodiment, sonic immersiveness, students will gain knowledge about cultural, historical, and practical perspectives of VR. Students will also learn technical skills in developing VR in Unity 3D. 3D modeling experience is not required in this class. This class is an integration of the production of 3D and 360 degree VR experience. Photogrammetry, 360 degree video production and editing, and other expressive media will also be introduced for advancing the development of VR.\nCredits 5\nInstructor The Staff\nQuarter Offered Summer\n"
    },
    {
        "coursename": "ARTG 142 Black Aesthetics: Interventions in Digital Media",
        "description": "Cross Listed Courses Enrollment is restricted to sophomore, junior, and senior art and design: games and playable media, and critical race and ethnic studies majors, and Black studies minors.",
        "genEd": "General Education Code PE-T",
        "credithours": "Credits 5",
        "instructor": "Instructor The Staff",
        "extrarequirements": "Requirements Enrollment is restricted to sophomore, junior, and senior art and design: games and playable media, and critical race and ethnic studies majors, and Black studies minors.",
        "quarteroffered": "none",
        "fulldesc": "ARTG 142 Black Aesthetics: Interventions in Digital Media\nHow do we conceptualize a Black Aesthetic in the realm of digital art and media? How do we re/define Black virtuality when, historically, computer graphics has failed to accurately render Blackness? This course looks at the field of digital media from a technological and cultural perspective, understanding the ways in which anti-Blackness has been embedded in our technology, from photography to video games. Concurrently, course examines the history of the Black Aesthetic as an interventionist art movement, and find ways to intervene in the contemporary digital media landscape.\nCredits 5\nCross Listed Courses Enrollment is restricted to sophomore, junior, and senior art and design: games and playable media, and critical race and ethnic studies majors, and Black studies minors.\nCross Listed Courses CRES 142\nInstructor The Staff\nRequirements Enrollment is restricted to sophomore, junior, and senior art and design: games and playable media, and critical race and ethnic studies majors, and Black studies minors.\nGeneral Education Code PE-T\n"
    },
    {
        "coursename": "ARTG 143 Ecofutures",
        "description": "Cross Listed Courses Prerequisite(s): ARTG 80H, and ARTG 80I or THEA 10 or THEA 20.",
        "genEd": "General Education Code PE-E",
        "credithours": "Credits 5",
        "instructor": "Instructor The Staff",
        "extrarequirements": "Requirements Prerequisite(s): ARTG 80H, and ARTG 80I or THEA 10 or THEA 20.",
        "quarteroffered": "Quarter Offered Winter",
        "fulldesc": "ARTG 143 Ecofutures\nStudents study the fields of ecofeminist art, climate fiction, virtual environmental art, Afrofuturism, Latinx futurism and Indigenous futurism, and create digital art relevant to these fields. The dual global crises of climate change and COVID-19 have forced a reevaluation of the idea of the human through a confrontation with the realities and histories of global colonialism and white supremacy. In response, social movements and artists have created artistic strategies which can envision futures beyond the horizon of the imagination of capitalism.\nCredits 5\nCross Listed Courses Prerequisite(s): ARTG 80H, and ARTG 80I or THEA 10 or THEA 20.\nCross Listed Courses THEA 143\nInstructor The Staff\nRequirements Prerequisite(s): ARTG 80H, and ARTG 80I or THEA 10 or THEA 20.\nGeneral Education Code PE-E\nQuarter Offered Winter\n"
    },
    {
        "coursename": "ARTG 145 Non-Digital Game Design",
        "description": "Looks specifically at the design of non-digital games. Surveys a variety of game types and designs. Students prototype card or board game, culminating in a final project that engages players on a socially relevant topic.",
        "genEd": "none",
        "credithours": "Credits 5",
        "instructor": "Instructor The Staff",
        "extrarequirements": "none",
        "quarteroffered": "none",
        "fulldesc": "ARTG 145 Non-Digital Game Design\nLooks specifically at the design of non-digital games. Surveys a variety of game types and designs. Students prototype card or board game, culminating in a final project that engages players on a socially relevant topic.\nCredits 5\nInstructor The Staff\n"
    },
    {
        "coursename": "ARTG 170 Game Design Studio I",
        "description": "Students create novel, interesting game concepts and outline and polish a game pitch for their yearlong project, starting with concept ideation and storyboarding to prototyping and presenting the game idea. This course is part one of the art and design: games and playable media capstone requirement.",
        "genEd": "none",
        "credithours": "Credits 5",
        "instructor": "Instructor The Staff",
        "extrarequirements": "Requirements Prerequisite(s): satisfaction of the Entry Level Writing and Composition requirements and ARTG 120 and CMPM 120. Enrollment restricted to senior art and design: games and playable media majors.",
        "quarteroffered": "Quarter Offered Fall",
        "fulldesc": "ARTG 170 Game Design Studio I\nStudents create novel, interesting game concepts and outline and polish a game pitch for their yearlong project, starting with concept ideation and storyboarding to prototyping and presenting the game idea. This course is part one of the art and design: games and playable media capstone requirement.\nCredits 5\nInstructor The Staff\nRequirements Prerequisite(s): satisfaction of the Entry Level Writing and Composition requirements and ARTG 120 and CMPM 120. Enrollment restricted to senior art and design: games and playable media majors.\nQuarter Offered Fall\n"
    },
    {
        "coursename": "ARTG 171 Game Design Studio II",
        "description": "Students craft the core loop of their yearlong game project. Students build the game, examine player feedback, and repeat the process to make the game better. This course places particular emphasis on advanced production techniques for working in teams, as well as software engineering practices for software design, software testing, and build management. This course is part two of the art and design, games and playable media capstone requirement.",
        "genEd": "none",
        "credithours": "Credits 7",
        "instructor": "Instructor The Staff",
        "extrarequirements": "Requirements Prerequisite(s): ARTG 170. Enrollment is restricted to senior art and design: games and playable media majors.",
        "quarteroffered": "Quarter Offered Winter",
        "fulldesc": "ARTG 171 Game Design Studio II\nStudents craft the core loop of their yearlong game project. Students build the game, examine player feedback, and repeat the process to make the game better. This course places particular emphasis on advanced production techniques for working in teams, as well as software engineering practices for software design, software testing, and build management. This course is part two of the art and design, games and playable media capstone requirement.\nCredits 7\nInstructor The Staff\nRequirements Prerequisite(s): ARTG 170. Enrollment is restricted to senior art and design: games and playable media majors.\nQuarter Offered Winter\n"
    },
    {
        "coursename": "ARTG 172 Game Design Studio III",
        "description": "Students scope and polish their final game designs. Students work towards releasing one specific game platform while coordinating across disciplinary boundaries to create and integrate all the necessary code, art, animation, and sound assets for their game. This course is part III of the art and design: games and playable media capstone requirement.",
        "genEd": "none",
        "credithours": "Credits 7",
        "instructor": "Instructor The Staff",
        "extrarequirements": "Requirements Prerequisite(s): ARTG 171. Enrollment is restricted to senior art and design: games and playable media majors.",
        "quarteroffered": "Quarter Offered Spring",
        "fulldesc": "ARTG 172 Game Design Studio III\nStudents scope and polish their final game designs. Students work towards releasing one specific game platform while coordinating across disciplinary boundaries to create and integrate all the necessary code, art, animation, and sound assets for their game. This course is part III of the art and design: games and playable media capstone requirement.\nCredits 7\nInstructor The Staff\nRequirements Prerequisite(s): ARTG 171. Enrollment is restricted to senior art and design: games and playable media majors.\nQuarter Offered Spring\n"
    },
    {
        "coursename": "ARTG 176 Game Design Collaborative",
        "description": "Supports students who are collaborating with the ARTG/CMPM 170-series teams on the creation of their capstone game projects. Enrollment is restricted to students who are working with senior game-design project groups, and by permission of the instructor,",
        "genEd": "none",
        "credithours": "Credits 2",
        "instructor": "Instructor The Staff ,",
        "extrarequirements": "Repeatable For Credit Yes",
        "quarteroffered": "Quarter Offered Winter, Spring",
        "fulldesc": "ARTG 176 Game Design Collaborative\nSupports students who are collaborating with the ARTG/CMPM 170-series teams on the creation of their capstone game projects. Enrollment is restricted to students who are working with senior game-design project groups, and by permission of the instructor,\nCredits 2\nInstructor The Staff ,\nRepeatable For Credit Yes\nQuarter Offered Winter, Spring\n"
    },
    {
        "coursename": "ARTG 199 Tutorial",
        "description": "Individual study in areas approved by sponsoring instructors. Tutorial may not be used to satisfy major requirements. Petition required, approved by instructor and department; petitions available on the program website.",
        "genEd": "none",
        "credithours": "Credits 5",
        "instructor": "Instructor The Staff",
        "extrarequirements": "Repeatable For Credit Yes",
        "quarteroffered": "Quarter Offered Fall, Winter, Spring",
        "fulldesc": "ARTG 199 Tutorial\nIndividual study in areas approved by sponsoring instructors. Tutorial may not be used to satisfy major requirements. Petition required, approved by instructor and department; petitions available on the program website.\nCredits 5\nInstructor The Staff\nRepeatable For Credit Yes\nQuarter Offered Fall, Winter, Spring\n"
    },
    {
        "coursename": "ARTG 199F Tutorial",
        "description": "Individual study in areas approved by sponsoring instructors. Tutorial may not be used to satisfy major requirements. Petition required, approved by instructor and department; petitions available on the program website.",
        "genEd": "none",
        "credithours": "Credits 2",
        "instructor": "Instructor The Staff",
        "extrarequirements": "Repeatable For Credit Yes",
        "quarteroffered": "Quarter Offered Fall, Winter, Spring",
        "fulldesc": "ARTG 199F Tutorial\nIndividual study in areas approved by sponsoring instructors. Tutorial may not be used to satisfy major requirements. Petition required, approved by instructor and department; petitions available on the program website.\nCredits 2\nInstructor The Staff\nRepeatable For Credit Yes\nQuarter Offered Fall, Winter, Spring\nCross-listed Courses\n"
    },
    {
        "coursename": "CMPM 179 Game Design Practicum",
        "description": "Provides the opportunity to practice the creation of novel computer games. Students learn a new game-making technology, then create three games using this technology.",
        "genEd": "General Education Code PR-C",
        "credithours": "Credits 5",
        "instructor": "Instructor The Staff, Jim Whitehead, Nathan Altice",
        "extrarequirements": "Requirements Prerequisite(s): CMPM 120 and CMPM 80K.",
        "quarteroffered": "none",
        "fulldesc": "CMPM 179 Game Design Practicum\nProvides the opportunity to practice the creation of novel computer games. Students learn a new game-making technology, then create three games using this technology.\nCredits 5\nCross Listed Courses ARTG 179\nInstructor The Staff, Jim Whitehead, Nathan Altice\nRequirements Prerequisite(s): CMPM 120 and CMPM 80K.\nGeneral Education Code PR-C\n"
    }
]