[
    {
        "coursename": "BIOC 100A Biochemistry and Molecular Biology",
        "description": "Fundamentals of molecular biology, structure and function of nucleic acids, and protein structure. Designed for students preparing for research careers in biochemistry and molecular biology. Lecture: 3-1/2 hours; discussion: 1-1/4 hours.",
        "genEd": "none",
        "credithours": "Credits 5",
        "instructor": "Instructor William Scott",
        "extrarequirements": "Requirements Prerequisite(s): CHEM 8B; and BIOL 20A.",
        "quarteroffered": "Quarter Offered Fall",
        "fulldesc": "BIOC 100A Biochemistry and Molecular Biology\nFundamentals of molecular biology, structure and function of nucleic acids, and protein structure. Designed for students preparing for research careers in biochemistry and molecular biology. Lecture: 3-1/2 hours; discussion: 1-1/4 hours.\nCredits 5\nInstructor William Scott\nRequirements Prerequisite(s): CHEM 8B; and BIOL 20A.\nQuarter Offered Fall\n"
    },
    {
        "coursename": "BIOC 100B Biochemistry and Molecular Biology",
        "description": "Covers principles of protein function from ligand binding and enzyme mechanism, kinetics and regulation to membrane composition and membrane protein function. Lecture: 3-1/2 hours; discussion: 1-1/4 hours.",
        "genEd": "none",
        "credithours": "Credits 5",
        "instructor": "Instructor Michael Stone",
        "extrarequirements": "Requirements Prerequisite(s): BIOC 100A",
        "quarteroffered": "Quarter Offered Winter",
        "fulldesc": "BIOC 100B Biochemistry and Molecular Biology\nCovers principles of protein function from ligand binding and enzyme mechanism, kinetics and regulation to membrane composition and membrane protein function. Lecture: 3-1/2 hours; discussion: 1-1/4 hours.\nCredits 5\nInstructor Michael Stone\nRequirements Prerequisite(s): BIOC 100A\nQuarter Offered Winter\n"
    },
    {
        "coursename": "BIOC 100C Biochemistry and Molecular Biology",
        "description": "Biochemistry: intermediary metabolism and bioenergetics. How enzymatically catalyzed reactions are organized and regulated; how energy from molecules is extracted for chemical work. Lecture: 3-1/2 hours; discussion: 1-1/4 hours. (Formerly Biochemistry .)",
        "genEd": "none",
        "credithours": "Credits 5",
        "instructor": "Instructor Hanns Boeger",
        "extrarequirements": "Requirements Prerequisite(s): BIOC 100B",
        "quarteroffered": "Quarter Offered Spring",
        "fulldesc": "BIOC 100C Biochemistry and Molecular Biology\nBiochemistry: intermediary metabolism and bioenergetics. How enzymatically catalyzed reactions are organized and regulated; how energy from molecules is extracted for chemical work. Lecture: 3-1/2 hours; discussion: 1-1/4 hours. (Formerly Biochemistry .)\nCredits 5\nInstructor Hanns Boeger\nRequirements Prerequisite(s): BIOC 100B\nQuarter Offered Spring\n"
    },
    {
        "coursename": "BIOC 110L Advanced Biochemistry Laboratory",
        "description": "An introduction to the major techniques used in the isolation and characterization of biological components. Laboratory: 8 hours; lecture: 1-3/4 hours. Students are billed a materials fee of $350.",
        "genEd": "none",
        "credithours": "Credits 5",
        "instructor": "Instructor Carrie Partch",
        "extrarequirements": "Requirements Prerequisite(s): BIOC 100B and satisfaction of the Entry Level Writing and Composition requirements. Enrollment is restricted to chemistry majors in the biochemistry concentration. Other majors by permission.",
        "quarteroffered": "Quarter Offered Spring",
        "fulldesc": "BIOC 110L Advanced Biochemistry Laboratory\nAn introduction to the major techniques used in the isolation and characterization of biological components. Laboratory: 8 hours; lecture: 1-3/4 hours. Students are billed a materials fee of $350.\nCredits 5\nInstructor Carrie Partch\nRequirements Prerequisite(s): BIOC 100B and satisfaction of the Entry Level Writing and Composition requirements. Enrollment is restricted to chemistry majors in the biochemistry concentration. Other majors by permission.\nQuarter Offered Spring\n"
    },
    {
        "coursename": "BIOC 163A Quantum Mechanics, Spectroscopy and Molecular Structure for Biochemistry and Molecular Biology",
        "description": "Detailed introduction to molecular quantum mechanics and application of spectroscopic and diffraction techniques to problems involving biological macromolecules. Designed as an alternative to CHEM 163A for the biochemistry and molecular biology major requirement. Students cannot receive credit for this course and CHEM 163A.",
        "genEd": "none",
        "credithours": "Credits 5",
        "instructor": "Instructor William Scott",
        "extrarequirements": "Requirements Prerequisite(s): CHEM 1B and CHEM 1C; and PHYS 5A, and PHYS 5B, or PHYS 6A and PHYS 6B; and previous or concurrent enrollment in PHYS 5C or PHYS 6C.",
        "quarteroffered": "Quarter Offered Winter",
        "fulldesc": "BIOC 163A Quantum Mechanics, Spectroscopy and Molecular Structure for Biochemistry and Molecular Biology\nDetailed introduction to molecular quantum mechanics and application of spectroscopic and diffraction techniques to problems involving biological macromolecules. Designed as an alternative to CHEM 163A for the biochemistry and molecular biology major requirement. Students cannot receive credit for this course and CHEM 163A.\nCredits 5\nInstructor William Scott\nRequirements Prerequisite(s): CHEM 1B and CHEM 1C; and PHYS 5A, and PHYS 5B, or PHYS 6A and PHYS 6B; and previous or concurrent enrollment in PHYS 5C or PHYS 6C.\nQuarter Offered Winter\n"
    },
    {
        "coursename": "BIOC 163B Biochemical Thermodynamics and Statistical Mechanics for Biochemistry and Molecular Biology",
        "description": "Detailed introduction to the fundamentals of classical and statistical thermodynamics and applications to problems involving biochemical equilibria, macromolecular structure and function. Course is designed as an alternative to CHEM 163B for partial fulfillment of the biochemistry and molecular biology major physical chemistry requirement. Students cannot receive credit for this course and CHEM 163B.",
        "genEd": "none",
        "credithours": "Credits 5",
        "instructor": "Instructor Glenn Milhauser",
        "extrarequirements": "Requirements Prerequisite(s): CHEM 1B and CHEM 1C; PHYS 6A or PHYS 5A; and previous or concurrent enrollment in BIOC 100A. .",
        "quarteroffered": "Quarter Offered Spring",
        "fulldesc": "BIOC 163B Biochemical Thermodynamics and Statistical Mechanics for Biochemistry and Molecular Biology\nDetailed introduction to the fundamentals of classical and statistical thermodynamics and applications to problems involving biochemical equilibria, macromolecular structure and function. Course is designed as an alternative to CHEM 163B for partial fulfillment of the biochemistry and molecular biology major physical chemistry requirement. Students cannot receive credit for this course and CHEM 163B.\nCredits 5\nInstructor Glenn Milhauser\nRequirements Prerequisite(s): CHEM 1B and CHEM 1C; PHYS 6A or PHYS 5A; and previous or concurrent enrollment in BIOC 100A. .\nQuarter Offered Spring\n"
    }
]