[
    {
        "coursename": "CRWN 1 Academic Literacy and Ethos: Ethical and Societal Implications of Emerging Technologies",
        "description": "Teaches foundational concepts for intellectual exploration and personal development within an academic community: analysis, critical thinking, metacognition, engagement with others across difference, and self-efficacy. Examines how technological revolutions happen, how they transform societies, and how these changes generate new ideological narratives.",
        "genEd": "none",
        "credithours": "Credits 5",
        "instructor": "Instructor The Staff",
        "extrarequirements": "Requirements Enrollment is restricted to first-year college members.",
        "quarteroffered": "Quarter Offered Fall",
        "fulldesc": "CRWN 1 Academic Literacy and Ethos: Ethical and Societal Implications of Emerging Technologies\nTeaches foundational concepts for intellectual exploration and personal development within an academic community: analysis, critical thinking, metacognition, engagement with others across difference, and self-efficacy. Examines how technological revolutions happen, how they transform societies, and how these changes generate new ideological narratives.\nCredits 5\nInstructor The Staff\nRequirements Enrollment is restricted to first-year college members.\nQuarter Offered Fall\n"
    },
    {
        "coursename": "CRWN 1A Introduction to University Life and Learning",
        "description": "CRWN 1A explores opportunities, expectations, and responsibilities in university life. Topics include: academic planning; general education requirements; majors and minors; campus policy; and preparation for CRWN 1A: Power & Representation. Students gain familiarity with resources for health, well-being, time management, academic success, cultivating just communities, sexual harassment and violence prevention, reflection on UCSC's principles of community, and an introduction to the living and learning tradition of Crown College. This course can be taken for Pass/No Pass grading only.",
        "genEd": "none",
        "credithours": "Credits 1",
        "instructor": "Instructor Marilyn Patton",
        "extrarequirements": "Requirements Enrollment is restricted to entering first-year Crown College students.",
        "quarteroffered": "Quarter Offered Summer",
        "fulldesc": "CRWN 1A Introduction to University Life and Learning\nCRWN 1A explores opportunities, expectations, and responsibilities in university life. Topics include: academic planning; general education requirements; majors and minors; campus policy; and preparation for CRWN 1A: Power & Representation. Students gain familiarity with resources for health, well-being, time management, academic success, cultivating just communities, sexual harassment and violence prevention, reflection on UCSC's principles of community, and an introduction to the living and learning tradition of Crown College. This course can be taken for Pass/No Pass grading only.\nCredits 1\nInstructor Marilyn Patton\nRequirements Enrollment is restricted to entering first-year Crown College students.\nQuarter Offered Summer\n"
    },
    {
        "coursename": "CRWN 28 Crown Student Leadership Development Seminar",
        "description": "Explore leadership as it relates to student development at Crown College. Examine how values, ethics, involvement, identity, and theory affect leadership in a variety of content areas. Evaluate student's leadership strengths to determine objectives for improvement.",
        "genEd": "none",
        "credithours": "Credits 2",
        "instructor": "none",
        "extrarequirements": "none",
        "quarteroffered": "none",
        "fulldesc": "CRWN 28 Crown Student Leadership Development Seminar\nExplore leadership as it relates to student development at Crown College. Examine how values, ethics, involvement, identity, and theory affect leadership in a variety of content areas. Evaluate student's leadership strengths to determine objectives for improvement.\nCredits 2\n"
    },
    {
        "coursename": "CRWN 31 Crown College Student Leadership in Action Seminar",
        "description": "Focuses on developing and establishing leadership skills and styles for new leaders at Crown College. Explores communication styles, group dynamics, community development, programming, moral development and conflict resolution concepts and strategies. Applies theory to action. Enrollment limited to college members and by permission of instructor.",
        "genEd": "none",
        "credithours": "Credits 2",
        "instructor": "none",
        "extrarequirements": "none",
        "quarteroffered": "none",
        "fulldesc": "CRWN 31 Crown College Student Leadership in Action Seminar\nFocuses on developing and establishing leadership skills and styles for new leaders at Crown College. Explores communication styles, group dynamics, community development, programming, moral development and conflict resolution concepts and strategies. Applies theory to action. Enrollment limited to college members and by permission of instructor.\nCredits 2\n"
    },
    {
        "coursename": "CRWN 60 The Environment on Film: Rhetoric of Ecocriticism",
        "description": "Examines the overt as well as the subtle cinematic elements that depict, ponder, and persuade concerning issues of the environment and the role of humans regarding nature, animals, and the human-made landscape.",
        "genEd": "General Education Code IM",
        "credithours": "Credits 5",
        "instructor": "none",
        "extrarequirements": "Requirements Enrollment is restricted to college members.",
        "quarteroffered": "none",
        "fulldesc": "CRWN 60 The Environment on Film: Rhetoric of Ecocriticism\nExamines the overt as well as the subtle cinematic elements that depict, ponder, and persuade concerning issues of the environment and the role of humans regarding nature, animals, and the human-made landscape.\nCredits 5\nRequirements Enrollment is restricted to college members.\nGeneral Education Code IM\n"
    },
    {
        "coursename": "CRWN 70 Introduction to Broadcast Media: Radio",
        "description": "Comprehensive history of noncommercial radio as a mass-communication medium. Course also serves as an introduction to UCSC's radio station KZSC-FM and broadcasting. Through lectures, hands-on instruction, and written assignments, students learn the fundamentals of program presentation and audio production. Prerequisite(s): After completing 20 hours of orientation volunteering at KZSC, students apply to the instructor. Enrollment is by permission of the instructor. Concurrent enrollment in CRWN 70L is required.",
        "genEd": "none",
        "credithours": "Credits 3",
        "instructor": "Instructor Shay Stoklos",
        "extrarequirements": "none",
        "quarteroffered": "Quarter Offered Fall, Winter, Spring",
        "fulldesc": "CRWN 70 Introduction to Broadcast Media: Radio\nComprehensive history of noncommercial radio as a mass-communication medium. Course also serves as an introduction to UCSC's radio station KZSC-FM and broadcasting. Through lectures, hands-on instruction, and written assignments, students learn the fundamentals of program presentation and audio production. Prerequisite(s): After completing 20 hours of orientation volunteering at KZSC, students apply to the instructor. Enrollment is by permission of the instructor. Concurrent enrollment in CRWN 70L is required.\nCredits 3\nInstructor Shay Stoklos\nQuarter Offered Fall, Winter, Spring\n"
    },
    {
        "coursename": "CRWN 70L Broadcast Production: Radio",
        "description": "Practical application of technical and creative skills in the KZSC studios. Production of audio content and promotional materials for broadcast. Critical evaluation in a workshop setting. Assignments require original research, professional writing, and the operation of complex technology. Prerequisite(s): After completing 20 hours of orientation volunteering at KZSC, students apply to the instructor. Enrollment is by permission of the instructor. Concurrent enrollment in CRWN 70 is required.",
        "genEd": "General Education Code PR-S",
        "credithours": "Credits 2",
        "instructor": "Instructor Shay Stocklos",
        "extrarequirements": "none",
        "quarteroffered": "Quarter Offered Fall, Winter, Spring",
        "fulldesc": "CRWN 70L Broadcast Production: Radio\nPractical application of technical and creative skills in the KZSC studios. Production of audio content and promotional materials for broadcast. Critical evaluation in a workshop setting. Assignments require original research, professional writing, and the operation of complex technology. Prerequisite(s): After completing 20 hours of orientation volunteering at KZSC, students apply to the instructor. Enrollment is by permission of the instructor. Concurrent enrollment in CRWN 70 is required.\nCredits 2\nInstructor Shay Stocklos\nGeneral Education Code PR-S\nQuarter Offered Fall, Winter, Spring\n"
    },
    {
        "coursename": "CRWN 79 Introduction to Social and Ethical Implications of Emerging Technologies",
        "description": "An introduction to the theme of Crown College, \"Social and Ethical Implications of Emerging Technologies\". Taught in a small class format and articulated around a group project, both of which help generate sense of belonging, and is the key to the success of our transfer students. The group project will be used to introduce academic research and also strategies for effective work in groups, which is an essential skill in most fields, and of particular relevance to STEM disciplines.",
        "genEd": "General Education Code PR-E",
        "credithours": "Credits 2",
        "instructor": "Instructor Abel Cornejo",
        "extrarequirements": "Requirements Enrollment is restricted to first-quarter transfer students.",
        "quarteroffered": "Quarter Offered Fall",
        "fulldesc": "CRWN 79 Introduction to Social and Ethical Implications of Emerging Technologies\nAn introduction to the theme of Crown College, \"Social and Ethical Implications of Emerging Technologies\". Taught in a small class format and articulated around a group project, both of which help generate sense of belonging, and is the key to the success of our transfer students. The group project will be used to introduce academic research and also strategies for effective work in groups, which is an essential skill in most fields, and of particular relevance to STEM disciplines.\nCredits 2\nInstructor Abel Cornejo\nRequirements Enrollment is restricted to first-quarter transfer students.\nGeneral Education Code PR-E\nQuarter Offered Fall\n"
    },
    {
        "coursename": "CRWN 80F Science Fictions",
        "description": "Examines how science fictions have imagined better and worse worlds, social relations, and identities by using science and technology. Students read novels and short stories from the 19th Century to the present and discuss and debate questions of justice, freedom, difference, and identity.",
        "genEd": "General Education Code TA",
        "credithours": "Credits 5",
        "instructor": "Instructor Dion Farquhar",
        "extrarequirements": "Requirements Prerequisite(s): satisfaction of the Entry Level Writing requirement.",
        "quarteroffered": "Quarter Offered Spring, Summer",
        "fulldesc": "CRWN 80F Science Fictions\nExamines how science fictions have imagined better and worse worlds, social relations, and identities by using science and technology. Students read novels and short stories from the 19th Century to the present and discuss and debate questions of justice, freedom, difference, and identity.\nCredits 5\nInstructor Dion Farquhar\nRequirements Prerequisite(s): satisfaction of the Entry Level Writing requirement.\nGeneral Education Code TA\nQuarter Offered Spring, Summer\n"
    },
    {
        "coursename": "CRWN 80J Cyborg Society: Myths, Realities, Choices",
        "description": "Examines content and methodologies of the emerging field of cyborgology. Includes social studies of science, anthropology, sociology, philosophy, politics, art, biology, and informatics.",
        "genEd": "General Education Code PE-T",
        "credithours": "Credits 5",
        "instructor": "Instructor Chris Gray",
        "extrarequirements": "none",
        "quarteroffered": "none",
        "fulldesc": "CRWN 80J Cyborg Society: Myths, Realities, Choices\nExamines content and methodologies of the emerging field of cyborgology. Includes social studies of science, anthropology, sociology, philosophy, politics, art, biology, and informatics.\nCredits 5\nInstructor Chris Gray\nGeneral Education Code PE-T\n"
    },
    {
        "coursename": "CRWN 80L Food Safety and Environmental Quality: The Complexities of a Safe Salad",
        "description": "In recent years, outbreaks of food-borne illness have alarmed farmers and consumers alike. This course examines the complexities of ensuring food safety in the complex natural, economic, and social settings that characterize U.S. food-production systems.",
        "genEd": "General Education Code PE-E",
        "credithours": "Credits 5",
        "instructor": "none",
        "extrarequirements": "none",
        "quarteroffered": "none",
        "fulldesc": "CRWN 80L Food Safety and Environmental Quality: The Complexities of a Safe Salad\nIn recent years, outbreaks of food-borne illness have alarmed farmers and consumers alike. This course examines the complexities of ensuring food safety in the complex natural, economic, and social settings that characterize U.S. food-production systems.\nCredits 5\nGeneral Education Code PE-E\n"
    },
    {
        "coursename": "CRWN 80S Undergraduate Seminar in Science, Technology, and Society",
        "description": "An honors seminar for first year students on selected topics that examine the relationship between science, technology, and society. Precise focus of each seminar varies and is announced by the college.",
        "genEd": "none",
        "credithours": "Credits 5",
        "instructor": "none",
        "extrarequirements": "Requirements Preference given to Crown College students. Enrollment is restricted to first-year and sophomore students.",
        "quarteroffered": "none",
        "fulldesc": "CRWN 80S Undergraduate Seminar in Science, Technology, and Society\nAn honors seminar for first year students on selected topics that examine the relationship between science, technology, and society. Precise focus of each seminar varies and is announced by the college.\nCredits 5\nRequirements Preference given to Crown College students. Enrollment is restricted to first-year and sophomore students.\n"
    },
    {
        "coursename": "CRWN 85 Visual Perception: A Window to Brain and Behavior",
        "description": "Investigates visual perception as an example of the correlation of brain and behavior. Uses a multidisciplinary analysis of the optical, biochemical, and neural components of the visual pathway leading to the perception of form, color, etc. Discusses the applications of neuroscience in the social sciences, the humanities, engineering, and the arts.",
        "genEd": "General Education Code SI",
        "credithours": "Credits 5",
        "instructor": "Instructor Eugene Switkes",
        "extrarequirements": "Requirements Enrollment is restricted to students in the Crown College or Cowell College first-year honors program.",
        "quarteroffered": "none",
        "fulldesc": "CRWN 85 Visual Perception: A Window to Brain and Behavior\nInvestigates visual perception as an example of the correlation of brain and behavior. Uses a multidisciplinary analysis of the optical, biochemical, and neural components of the visual pathway leading to the perception of form, color, etc. Discusses the applications of neuroscience in the social sciences, the humanities, engineering, and the arts.\nCredits 5\nInstructor Eugene Switkes\nRequirements Enrollment is restricted to students in the Crown College or Cowell College first-year honors program.\nGeneral Education Code SI\n"
    },
    {
        "coursename": "CRWN 86 Storytelling in a Digital Age",
        "description": "Explores theories and practices of narrative form, subjectivity, political and social engagement, and identity. Students engage with a variety of methods and approaches to communicating effectively and reaching audiences in the modern digital arena. Students develop, produce, and share several digital stories using film, photo, audio, and mixed media methods. (Formerly offered as Professional Communication in a Digital Age.)",
        "genEd": "General Education Code PR-C",
        "credithours": "Credits 5",
        "instructor": "Instructor Kathleen Greaney",
        "extrarequirements": "Requirements Enrollment is restricted to College Scholars Students.",
        "quarteroffered": "Quarter Offered Winter",
        "fulldesc": "CRWN 86 Storytelling in a Digital Age\nExplores theories and practices of narrative form, subjectivity, political and social engagement, and identity. Students engage with a variety of methods and approaches to communicating effectively and reaching audiences in the modern digital arena. Students develop, produce, and share several digital stories using film, photo, audio, and mixed media methods. (Formerly offered as Professional Communication in a Digital Age.)\nCredits 5\nInstructor Kathleen Greaney\nRequirements Enrollment is restricted to College Scholars Students.\nGeneral Education Code PR-C\nQuarter Offered Winter\n"
    },
    {
        "coursename": "CRWN 87 Understanding and Communicating the Science Behind Global Warming",
        "description": "Provides tools to critically assess the current debate on the implications of global warming and to communicate the issues to the public effectively. Examines how questions are framed and addressed by scientists in general and how they are framed and addressed given our current understanding of the problem of global warming based on basic physics and statistical analyses of climate data. Includes practical assignments and guest lectures by local UCSC experts.",
        "genEd": "General Education Code SR",
        "credithours": "Credits 5",
        "instructor": "Instructor C Martin Gaskell",
        "extrarequirements": "Requirements Prerequisite(s): Enrollment in the College Scholars Program.",
        "quarteroffered": "none",
        "fulldesc": "CRWN 87 Understanding and Communicating the Science Behind Global Warming\nProvides tools to critically assess the current debate on the implications of global warming and to communicate the issues to the public effectively. Examines how questions are framed and addressed by scientists in general and how they are framed and addressed given our current understanding of the problem of global warming based on basic physics and statistical analyses of climate data. Includes practical assignments and guest lectures by local UCSC experts.\nCredits 5\nInstructor C Martin Gaskell\nRequirements Prerequisite(s): Enrollment in the College Scholars Program.\nGeneral Education Code SR\n"
    },
    {
        "coursename": "CRWN 88 Computational Futurology:Use of Data Analysis for Predicting Human Behavior and Activity",
        "description": "Investigates statistical and computational methods for the prediction of human activity, both at the individual and at the collective level. Students learn to evaluate and critique famous predictions, and consider the ethical and social implications of predictive technologies. Articulated around a creative group project to integrate concepts learned in the course.",
        "genEd": "General Education Code SR",
        "credithours": "Credits 5",
        "instructor": "Instructor Peter Rothman",
        "extrarequirements": "Requirements Enrollment is restricted to College Scholar Students.",
        "quarteroffered": "Quarter Offered Fall",
        "fulldesc": "CRWN 88 Computational Futurology:Use of Data Analysis for Predicting Human Behavior and Activity\nInvestigates statistical and computational methods for the prediction of human activity, both at the individual and at the collective level. Students learn to evaluate and critique famous predictions, and consider the ethical and social implications of predictive technologies. Articulated around a creative group project to integrate concepts learned in the course.\nCredits 5\nInstructor Peter Rothman\nRequirements Enrollment is restricted to College Scholar Students.\nGeneral Education Code SR\nQuarter Offered Fall\n"
    },
    {
        "coursename": "CRWN 89 Workshop in Computational Biology",
        "description": "Designed to engage students with training in areas related to computational biology. Covers basic biological, statistical, and computational concepts needed for hands-on research; training students to read primary literature and do collaborative work in an interdisciplinary setting. Enrollment restricted to students with some background in programming, math or biology and by permission of instructor.",
        "genEd": "General Education Code TA",
        "credithours": "Credits 5",
        "instructor": "Instructor The Staff",
        "extrarequirements": "none",
        "quarteroffered": "none",
        "fulldesc": "CRWN 89 Workshop in Computational Biology\nDesigned to engage students with training in areas related to computational biology. Covers basic biological, statistical, and computational concepts needed for hands-on research; training students to read primary literature and do collaborative work in an interdisciplinary setting. Enrollment restricted to students with some background in programming, math or biology and by permission of instructor.\nCredits 5\nInstructor The Staff\nGeneral Education Code TA\n"
    },
    {
        "coursename": "CRWN 90 Start-up Entrepreneurship Academy",
        "description": "Introduction to the basics of setting up a start-up company using the Lean Launchpad/NSF I-Corps model of instruction. Students learn principles of data collection, marketing processes, and resources needed for new companies. The class is articulated around the design of a business plan, in groups of 4-5 students coached by a successful entrepreneur, and culminates in a presentation. The market research for the project involves talking to at least 5 potential customers, partners, channels and/or related experts each week.",
        "genEd": "General Education Code PR-E",
        "credithours": "Credits 5",
        "instructor": "none",
        "extrarequirements": "Requirements Enrollment is restricted to College Scholar Students.",
        "quarteroffered": "Quarter Offered Winter, Summer",
        "fulldesc": "CRWN 90 Start-up Entrepreneurship Academy\nIntroduction to the basics of setting up a start-up company using the Lean Launchpad/NSF I-Corps model of instruction. Students learn principles of data collection, marketing processes, and resources needed for new companies. The class is articulated around the design of a business plan, in groups of 4-5 students coached by a successful entrepreneur, and culminates in a presentation. The market research for the project involves talking to at least 5 potential customers, partners, channels and/or related experts each week.\nCredits 5\nRequirements Enrollment is restricted to College Scholar Students.\nGeneral Education Code PR-E\nQuarter Offered Winter, Summer\n"
    },
    {
        "coursename": "CRWN 91 Marketing for Good",
        "description": "Service-learning class that takes students through the process of creating a marketing plan for a real client. Begins with design and marketing fundamentals and the marketing brief. Teams are formed and assigned projects with local businesses or UCSC startups. Client needs are established through interviews. After a clear understanding of the problem is established, ideation occurs with solutions developed and executed. These may include creating branding, logo design, messaging, digital storytelling (through film, website, social media campaigns), interior design, and product design specification feedback and posters.",
        "genEd": "General Education Code PR-S",
        "credithours": "Credits 5",
        "instructor": "Instructor Rick Vargas",
        "extrarequirements": "Repeatable For Credit Yes",
        "quarteroffered": "Quarter Offered Fall, Spring",
        "fulldesc": "CRWN 91 Marketing for Good\nService-learning class that takes students through the process of creating a marketing plan for a real client. Begins with design and marketing fundamentals and the marketing brief. Teams are formed and assigned projects with local businesses or UCSC startups. Client needs are established through interviews. After a clear understanding of the problem is established, ideation occurs with solutions developed and executed. These may include creating branding, logo design, messaging, digital storytelling (through film, website, social media campaigns), interior design, and product design specification feedback and posters.\nCredits 5\nInstructor Rick Vargas\nRepeatable For Credit Yes\nGeneral Education Code PR-S\nQuarter Offered Fall, Spring\n"
    },
    {
        "coursename": "CRWN 92 Social and Creative Entrepreneurship",
        "description": "Helps students discover and develop their own business idea that does the world good. Examines leadership and provides tools to research community issues and to develop sustainable business models. Guest lecturers and project mentors introduce students to business and civil leaders.",
        "genEd": "General Education Code PE-H",
        "credithours": "Credits 5",
        "instructor": "Instructor Nada Miljkovic",
        "extrarequirements": "none",
        "quarteroffered": "Quarter Offered Spring",
        "fulldesc": "CRWN 92 Social and Creative Entrepreneurship\nHelps students discover and develop their own business idea that does the world good. Examines leadership and provides tools to research community issues and to develop sustainable business models. Guest lecturers and project mentors introduce students to business and civil leaders.\nCredits 5\nInstructor Nada Miljkovic\nGeneral Education Code PE-H\nQuarter Offered Spring\n"
    },
    {
        "coursename": "CRWN 93 Field Study",
        "description": "Provides for individual programs of study sponsored by the college and performed off campus. Students should review plans with an appropriate fellow of the college. A proposal should be presented to the college academic preceptor no later than the seventh week of the preceding quarter. Credit is granted by the sponsor upon approval of the work performed. Students submit petition to sponsoring agency.",
        "genEd": "none",
        "credithours": "Credits 5",
        "instructor": "none",
        "extrarequirements": "Repeatable For Credit Yes",
        "quarteroffered": "Quarter Offered Fall, Winter, Spring",
        "fulldesc": "CRWN 93 Field Study\nProvides for individual programs of study sponsored by the college and performed off campus. Students should review plans with an appropriate fellow of the college. A proposal should be presented to the college academic preceptor no later than the seventh week of the preceding quarter. Credit is granted by the sponsor upon approval of the work performed. Students submit petition to sponsoring agency.\nCredits 5\nRepeatable For Credit Yes\nQuarter Offered Fall, Winter, Spring\n"
    },
    {
        "coursename": "CRWN 93F Field Study",
        "description": "Provides for individual field study in the vicinity of the campus under the direct supervision of a faculty sponsor. Students submit petition to sponsoring agency.",
        "genEd": "none",
        "credithours": "Credits 2",
        "instructor": "none",
        "extrarequirements": "Repeatable For Credit Yes",
        "quarteroffered": "Quarter Offered Fall, Winter, Spring",
        "fulldesc": "CRWN 93F Field Study\nProvides for individual field study in the vicinity of the campus under the direct supervision of a faculty sponsor. Students submit petition to sponsoring agency.\nCredits 2\nRepeatable For Credit Yes\nQuarter Offered Fall, Winter, Spring\n"
    },
    {
        "coursename": "CRWN 95 GetVirtual Business Assistance",
        "description": "Community service-oriented class provides a supervised learning experience for students who deliver real solutions to local businesses while gaining valuable practical skills and an opportunity to integrate their academic coursework with community involvement. Teams are formed and businesses assigned while students are trained to do interviews, write proposals, project-manage, design websites, and marketing campaigns. No prerequisites are required and familiarity in the following areas is preferred: the lean startup method, the business model canvas, and customer discovery. May be repeated for credit.",
        "genEd": "General Education Code PR-S",
        "credithours": "Credits 5",
        "instructor": "Instructor Nada Milijkovic",
        "extrarequirements": "Repeatable For Credit Yes",
        "quarteroffered": "Quarter Offered Fall, Winter, Spring, Summer",
        "fulldesc": "CRWN 95 GetVirtual Business Assistance\nCommunity service-oriented class provides a supervised learning experience for students who deliver real solutions to local businesses while gaining valuable practical skills and an opportunity to integrate their academic coursework with community involvement. Teams are formed and businesses assigned while students are trained to do interviews, write proposals, project-manage, design websites, and marketing campaigns. No prerequisites are required and familiarity in the following areas is preferred: the lean startup method, the business model canvas, and customer discovery. May be repeated for credit.\nCredits 5\nInstructor Nada Milijkovic\nRepeatable For Credit Yes\nGeneral Education Code PR-S\nQuarter Offered Fall, Winter, Spring, Summer\n"
    },
    {
        "coursename": "CRWN 96 Digital Theater Workshop: Theorizing Culture and the Future",
        "description": "Teaches different interpretation tools to be applied to a selection of dramatic literature in discussions. Students integrate these skills and develop their creativity through mounting a production of a play which addresses the impact of technology in society.",
        "genEd": "General Education Code TA",
        "credithours": "Credits 5",
        "instructor": "Instructor Abel Cornejo",
        "extrarequirements": "none",
        "quarteroffered": "Quarter Offered Winter",
        "fulldesc": "CRWN 96 Digital Theater Workshop: Theorizing Culture and the Future\nTeaches different interpretation tools to be applied to a selection of dramatic literature in discussions. Students integrate these skills and develop their creativity through mounting a production of a play which addresses the impact of technology in society.\nCredits 5\nInstructor Abel Cornejo\nGeneral Education Code TA\nQuarter Offered Winter\n"
    },
    {
        "coursename": "CRWN 97A Foundations of Applied Ethics and Values of Emerging Technologies",
        "description": "Provides the foundational skills for actively participating in ethical discussions on the impact of emerging technologies and opportunities. Also designed to help develop the necessary skills for hands-on skills in teamwork, problem-solving, and communication. The course will consist of readings, lectures and presentations, participation in the discussion forum,  a set of written assignments, and a group project. CRWN97A coordinates with CRWN97B, an internship at CAEVET, Crown Center for Applied Ethics and Values of Emerging Technologies.",
        "genEd": "General Education Code PR-E",
        "credithours": "Credits 2",
        "instructor": "Instructor Linda Glenn",
        "extrarequirements": "none",
        "quarteroffered": "none",
        "fulldesc": "CRWN 97A Foundations of Applied Ethics and Values of Emerging Technologies\nProvides the foundational skills for actively participating in ethical discussions on the impact of emerging technologies and opportunities. Also designed to help develop the necessary skills for hands-on skills in teamwork, problem-solving, and communication. The course will consist of readings, lectures and presentations, participation in the discussion forum,  a set of written assignments, and a group project. CRWN97A coordinates with CRWN97B, an internship at CAEVET, Crown Center for Applied Ethics and Values of Emerging Technologies.\nCredits 2\nInstructor Linda Glenn\nGeneral Education Code PR-E\n"
    },
    {
        "coursename": "CRWN 97B Center for Applied Ethics and Values of Emerging Technologies (CAEVET) Internship",
        "description": "Focuses on developing students' leadership skills that builds on Crown 97A, an introductory class to applied ethics. Interns choose from a list of showcase themes and developing activities to deepen their understanding of the selected topic and reflect on how they can help enact change. These include current events discussions, the generation of content for the center's website, interviewing leaders/influencers, and proposing an action-oriented activity or program to further the mission of the center. Crown 97 provides an intellectual community to support and provide feedback for each intern. Prerequisite(s): CRWN 97A. Enrollment is by interview and permission of the instructor.",
        "genEd": "General Education Code PR-S",
        "credithours": "Credits 2",
        "instructor": "Instructor Linda Glenn",
        "extrarequirements": "none",
        "quarteroffered": "Quarter Offered Spring",
        "fulldesc": "CRWN 97B Center for Applied Ethics and Values of Emerging Technologies (CAEVET) Internship\nFocuses on developing students' leadership skills that builds on Crown 97A, an introductory class to applied ethics. Interns choose from a list of showcase themes and developing activities to deepen their understanding of the selected topic and reflect on how they can help enact change. These include current events discussions, the generation of content for the center's website, interviewing leaders/influencers, and proposing an action-oriented activity or program to further the mission of the center. Crown 97 provides an intellectual community to support and provide feedback for each intern. Prerequisite(s): CRWN 97A. Enrollment is by interview and permission of the instructor.\nCredits 2\nInstructor Linda Glenn\nGeneral Education Code PR-S\nQuarter Offered Spring\n"
    },
    {
        "coursename": "CRWN 98 Podcasting: Digital Storytelling",
        "description": "Course walks students through the process of creating a podcast from concept to broadcast. Students' podcasts can be based on any research project or subject that they want. Class provides students with working knowledge of current trends in audio production and includes lessons on sound gathering using professional sound gear as well as cell phones, interviewing, script writing, audio editing and developing a \"radio voice.\" Students watch each other's progress, learning to collaborate, problem-solve and take risks together. Finally, the class also examines the media and trains students to think critically about stories they consume.",
        "genEd": "General Education Code PR-C",
        "credithours": "Credits 2",
        "instructor": "Instructor Nada Milijkovic",
        "extrarequirements": "Requirements Prerequisite(s): CRWN 1 or by permission of the instructor.",
        "quarteroffered": "Quarter Offered Winter, Summer",
        "fulldesc": "CRWN 98 Podcasting: Digital Storytelling\nCourse walks students through the process of creating a podcast from concept to broadcast. Students' podcasts can be based on any research project or subject that they want. Class provides students with working knowledge of current trends in audio production and includes lessons on sound gathering using professional sound gear as well as cell phones, interviewing, script writing, audio editing and developing a \"radio voice.\" Students watch each other's progress, learning to collaborate, problem-solve and take risks together. Finally, the class also examines the media and trains students to think critically about stories they consume.\nCredits 2\nInstructor Nada Milijkovic\nRequirements Prerequisite(s): CRWN 1 or by permission of the instructor.\nGeneral Education Code PR-C\nQuarter Offered Winter, Summer\n"
    },
    {
        "coursename": "CRWN 99F Tutorial",
        "description": "Various topics to be arranged between student and instructor. Students submit petition to sponsoring agency.",
        "genEd": "none",
        "credithours": "Credits 2",
        "instructor": "none",
        "extrarequirements": "Repeatable For Credit Yes",
        "quarteroffered": "Quarter Offered Fall, Winter, Spring",
        "fulldesc": "CRWN 99F Tutorial\nVarious topics to be arranged between student and instructor. Students submit petition to sponsoring agency.\nCredits 2\nRepeatable For Credit Yes\nQuarter Offered Fall, Winter, Spring\n"
    },
    {
        "coursename": "CRWN 123 Examining Our Life Through Writing",
        "description": "Writing-intensive seminar. Based on course readings and discussions, students write reflective response papers at the end of each class and weekly papers on their own lives and what they care most about. Intense class discussions, often started by students sharing their essays. Prerequisite(s): satisfaction of the Composition 1 requirement. Admission by permission of instructor after student reads lengthy syllabus, writes application, and interviews with instructor during faculty office hours.",
        "genEd": "none",
        "credithours": "Credits 5",
        "instructor": "Instructor Frank Andrews",
        "extrarequirements": "none",
        "quarteroffered": "none",
        "fulldesc": "CRWN 123 Examining Our Life Through Writing\nWriting-intensive seminar. Based on course readings and discussions, students write reflective response papers at the end of each class and weekly papers on their own lives and what they care most about. Intense class discussions, often started by students sharing their essays. Prerequisite(s): satisfaction of the Composition 1 requirement. Admission by permission of instructor after student reads lengthy syllabus, writes application, and interviews with instructor during faculty office hours.\nCredits 5\nInstructor Frank Andrews\n"
    },
    {
        "coursename": "CRWN 185 Career and Internship Preparation",
        "description": "For students preparing for an internship experience or career position. Students undertake career development as a continuous lifelong process: learn techniques for an effective job search, such as preparing a resume and cover letter, interviewing and networking skills; and learn how to more clearly articulate their future educational and professional goals.",
        "genEd": "none",
        "credithours": "Credits 2",
        "instructor": "Instructor The Staff",
        "extrarequirements": "none",
        "quarteroffered": "none",
        "fulldesc": "CRWN 185 Career and Internship Preparation\nFor students preparing for an internship experience or career position. Students undertake career development as a continuous lifelong process: learn techniques for an effective job search, such as preparing a resume and cover letter, interviewing and networking skills; and learn how to more clearly articulate their future educational and professional goals.\nCredits 2\nInstructor The Staff\n"
    },
    {
        "coursename": "CRWN 192 Directed Student Teaching",
        "description": "Teaching of a lower-division seminar by an upper-division student under faculty supervision. (See CRWN 42.)",
        "genEd": "none",
        "credithours": "Credits 5",
        "instructor": "none",
        "extrarequirements": "none",
        "quarteroffered": "none",
        "fulldesc": "CRWN 192 Directed Student Teaching\nTeaching of a lower-division seminar by an upper-division student under faculty supervision. (See CRWN 42.)\nCredits 5\n"
    },
    {
        "coursename": "CRWN 198 Independent Field Study",
        "description": "Provides for college-sponsored individual study programs off campus. Approval of student's faculty sponsor and college academic provost required.",
        "genEd": "none",
        "credithours": "Credits 5",
        "instructor": "none",
        "extrarequirements": "none",
        "quarteroffered": "Quarter Offered Fall, Winter, Spring",
        "fulldesc": "CRWN 198 Independent Field Study\nProvides for college-sponsored individual study programs off campus. Approval of student's faculty sponsor and college academic provost required.\nCredits 5\nQuarter Offered Fall, Winter, Spring\n"
    },
    {
        "coursename": "CRWN 199 Tutorial",
        "description": "Various topics to be arranged between student and instructor. Students submit petition to sponsoring agency.",
        "genEd": "none",
        "credithours": "Credits 5",
        "instructor": "none",
        "extrarequirements": "Repeatable For Credit Yes",
        "quarteroffered": "Quarter Offered Fall, Winter, Spring",
        "fulldesc": "CRWN 199 Tutorial\nVarious topics to be arranged between student and instructor. Students submit petition to sponsoring agency.\nCredits 5\nRepeatable For Credit Yes\nQuarter Offered Fall, Winter, Spring\n"
    },
    {
        "coursename": "CRWN 199F Tutorial",
        "description": "Various topics to be arranged between student and instructor. Students submit petition to sponsoring agency.",
        "genEd": "none",
        "credithours": "Credits 2",
        "instructor": "none",
        "extrarequirements": "Repeatable For Credit Yes",
        "quarteroffered": "Quarter Offered Fall, Winter, Spring",
        "fulldesc": "CRWN 199F Tutorial\nVarious topics to be arranged between student and instructor. Students submit petition to sponsoring agency.\nCredits 2\nRepeatable For Credit Yes\nQuarter Offered Fall, Winter, Spring\n"
    }
]