[
    {
        "coursename": "NLP 201 Natural Language Processing I",
        "description": "The first course in a series covering the core concepts and algorithms for the theory and practice of natural language processing (NLP), the creation of computer programs that can understand, generate, and learn natural language.",
        "genEd": "none",
        "credithours": "Credits 5",
        "instructor": "Instructor Jeffrey Flanigan",
        "extrarequirements": "Requirements Prerequisite(s): Enrollment is restricted to natural language processing graduate students, and computer science and engineering doctoral students by permission of instructor.",
        "quarteroffered": "Quarter Offered Fall",
        "fulldesc": "NLP 201 Natural Language Processing I\nThe first course in a series covering the core concepts and algorithms for the theory and practice of natural language processing (NLP), the creation of computer programs that can understand, generate, and learn natural language.\nCredits 5\nInstructor Jeffrey Flanigan\nRequirements Prerequisite(s): Enrollment is restricted to natural language processing graduate students, and computer science and engineering doctoral students by permission of instructor.\nQuarter Offered Fall\n"
    },
    {
        "coursename": "NLP 202 Natural Language Processing II",
        "description": "This is the second course in a series covering the core concepts and algorithms for the theory and practice of natural language processing (NLP)\u2014the creation of computer programs that can understand, generate, and learn natural language.",
        "genEd": "none",
        "credithours": "Credits 5",
        "instructor": "Instructor Jeffrey Flanigan",
        "extrarequirements": "Requirements Prerequisite(s): NLP 201. Enrollment is restricted to natural language processing graduate students.",
        "quarteroffered": "Quarter Offered Winter",
        "fulldesc": "NLP 202 Natural Language Processing II\nThis is the second course in a series covering the core concepts and algorithms for the theory and practice of natural language processing (NLP)\u2014the creation of computer programs that can understand, generate, and learn natural language.\nCredits 5\nInstructor Jeffrey Flanigan\nRequirements Prerequisite(s): NLP 201. Enrollment is restricted to natural language processing graduate students.\nQuarter Offered Winter\n"
    },
    {
        "coursename": "NLP 203 Natural Language Processing III",
        "description": "Third and final course in a series covering the core concepts and algorithms for the theory and practice of natural language processing (NLP)\u2014the creation of computer programs that can understand, generate, and learn natural language.",
        "genEd": "none",
        "credithours": "Credits 5",
        "instructor": "Instructor Jeffrey Flanigan, The Staff",
        "extrarequirements": "Requirements Prerequisite(s): NLP 201 and NLP 202.",
        "quarteroffered": "Quarter Offered Spring",
        "fulldesc": "NLP 203 Natural Language Processing III\nThird and final course in a series covering the core concepts and algorithms for the theory and practice of natural language processing (NLP)\u2014the creation of computer programs that can understand, generate, and learn natural language.\nCredits 5\nInstructor Jeffrey Flanigan, The Staff\nRequirements Prerequisite(s): NLP 201 and NLP 202.\nQuarter Offered Spring\n"
    },
    {
        "coursename": "NLP 220 Data Science and Machine Learning Fundamentals",
        "description": "Covers a broad set of tools and core skills required for working with Natural Language Data. Covers core traditional machine learning methods such as classification methods using Naive Bayes, SVMs, Linear regression and Support Vector Regression, as well as the use of Pytorch and other programming frameworks commonly used in the field. Also includes methods used for collecting, merging, cleaning, structuring and analyzing the properties of large and heterogeneous datasets of natural language, in order to address questions and support applications relying on those data. Course covers working with existing corpora as well as the challenges in collecting new corpora. (Formerly Data Collection, Wrangling and Crowdsourcing.)",
        "genEd": "none",
        "credithours": "Credits 5",
        "instructor": "Instructor Adwait Ratnaparkhi",
        "extrarequirements": "Requirements Enrollment is restricted to natural language processing graduate students.",
        "quarteroffered": "Quarter Offered Fall",
        "fulldesc": "NLP 220 Data Science and Machine Learning Fundamentals\nCovers a broad set of tools and core skills required for working with Natural Language Data. Covers core traditional machine learning methods such as classification methods using Naive Bayes, SVMs, Linear regression and Support Vector Regression, as well as the use of Pytorch and other programming frameworks commonly used in the field. Also includes methods used for collecting, merging, cleaning, structuring and analyzing the properties of large and heterogeneous datasets of natural language, in order to address questions and support applications relying on those data. Course covers working with existing corpora as well as the challenges in collecting new corpora. (Formerly Data Collection, Wrangling and Crowdsourcing.)\nCredits 5\nInstructor Adwait Ratnaparkhi\nRequirements Enrollment is restricted to natural language processing graduate students.\nQuarter Offered Fall\n"
    },
    {
        "coursename": "NLP 243 Deep Learning for Natural Language Processing",
        "description": "Introduction to machine learning models and algorithms for natural language processing (NLP) including deep learning approaches. Targeted at professional master's degree students, course focuses on applications and current use of these methods in industry. Topics include: an introduction to standard neural network learning methods such as feed-forward neural networks; recurrent neural networks; convolutional neural networks; and encoder-decoder models with applications to natural language processing problems such as utterance classification and sequence tagging. (Formerly Machine Learning for Natural Language Processing.)",
        "genEd": "none",
        "credithours": "Credits 5",
        "instructor": "Instructor The Staff",
        "extrarequirements": "Requirements Enrollment is restricted to natural language processing graduate students.",
        "quarteroffered": "Quarter Offered Fall",
        "fulldesc": "NLP 243 Deep Learning for Natural Language Processing\nIntroduction to machine learning models and algorithms for natural language processing (NLP) including deep learning approaches. Targeted at professional master's degree students, course focuses on applications and current use of these methods in industry. Topics include: an introduction to standard neural network learning methods such as feed-forward neural networks; recurrent neural networks; convolutional neural networks; and encoder-decoder models with applications to natural language processing problems such as utterance classification and sequence tagging. (Formerly Machine Learning for Natural Language Processing.)\nCredits 5\nInstructor The Staff\nRequirements Enrollment is restricted to natural language processing graduate students.\nQuarter Offered Fall\n"
    },
    {
        "coursename": "NLP 244 Advanced Machine Learning for Natural Language Processing",
        "description": "Covers advanced deep machine learning models and algorithms for Natural Language Processing, such as transformers, pre-trained large language models, contextual embeddings, multi-modal embeddings, mullti-task learning, and reinforcement learning. Provides both theoretical and intuitive understanding of NLP learning models.",
        "genEd": "none",
        "credithours": "Credits 5",
        "instructor": "Instructor The Staff",
        "extrarequirements": "Requirements Prerequisite(s): NLP 243 or CSE 244B. Enrollment is restricted to natural language processing graduate students and computer science and engineering doctoral students, or by permission of instructor.",
        "quarteroffered": "Quarter Offered Spring",
        "fulldesc": "NLP 244 Advanced Machine Learning for Natural Language Processing\nCovers advanced deep machine learning models and algorithms for Natural Language Processing, such as transformers, pre-trained large language models, contextual embeddings, multi-modal embeddings, mullti-task learning, and reinforcement learning. Provides both theoretical and intuitive understanding of NLP learning models.\nCredits 5\nInstructor The Staff\nRequirements Prerequisite(s): NLP 243 or CSE 244B. Enrollment is restricted to natural language processing graduate students and computer science and engineering doctoral students, or by permission of instructor.\nQuarter Offered Spring\n"
    },
    {
        "coursename": "NLP 245 Conversational Agents",
        "description": "Reviews recent work on conversational AI systems for task-oriented, informational, and social conversations with machines. Students read and review theoretical and technical papers from journals and conference proceedings, present paper summaries, and engage in discussions. A research project is required.",
        "genEd": "none",
        "credithours": "Credits 5",
        "instructor": "none",
        "extrarequirements": "Requirements Requirements Prerequisite(s): NLP 201 and NLP 243 or CSE 244B. Enrollment is restricted to natural language processing graduate students and computer science and engineering doctoral students, or by permission of instructor.",
        "quarteroffered": "none",
        "fulldesc": "NLP 245 Conversational Agents\nReviews recent work on conversational AI systems for task-oriented, informational, and social conversations with machines. Students read and review theoretical and technical papers from journals and conference proceedings, present paper summaries, and engage in discussions. A research project is required.\nCredits 5\nRequirements Requirements Prerequisite(s): NLP 201 and NLP 243 or CSE 244B. Enrollment is restricted to natural language processing graduate students and computer science and engineering doctoral students, or by permission of instructor.\n"
    },
    {
        "coursename": "NLP 255 Topics in Applied Natural Language Processing",
        "description": "Gives students a solid foundation in a specific application area of natural language processing, by learning about the theories, methods, tools, and techniques typically used in this area. The application area varies each quarter, with expected topics to include Information Extraction, Question Answering, Natural Language Generation, Sentiment Analysis, and others. Students learn about the state of the art and open challenges, and have the opportunity to explore and experiment with both standard algorithms and new emerging approaches.",
        "genEd": "none",
        "credithours": "Credits 5",
        "instructor": "Instructor Marilyn Walker, Dilek Hakkani-Tur",
        "extrarequirements": "Repeatable For Credit Yes",
        "quarteroffered": "none",
        "fulldesc": "NLP 255 Topics in Applied Natural Language Processing\nGives students a solid foundation in a specific application area of natural language processing, by learning about the theories, methods, tools, and techniques typically used in this area. The application area varies each quarter, with expected topics to include Information Extraction, Question Answering, Natural Language Generation, Sentiment Analysis, and others. Students learn about the state of the art and open challenges, and have the opportunity to explore and experiment with both standard algorithms and new emerging approaches.\nCredits 5\nInstructor Marilyn Walker, Dilek Hakkani-Tur\nRequirements Prerequisite(s): NLP 201 and NLP 202 and NLP 220 and NLP 244 and either NLP 243 or CSE 244B. Enrollment is restricted to natural language processing graduate students and computer science and engineering Ph.D. students, or by permission of the instructor.\nRepeatable For Credit Yes\n"
    },
    {
        "coursename": "NLP 267 Machine Translation",
        "description": "Machine Translation systems can instantly translate between any pair of over eighty human languages such as German to English or French to Russian. Modern translation systems learn to translate by reading millions of words of already translated text. This course covers the models and algorithms used by such systems and explains how they are able to automatically translate one human language to another. The course covers fundamental building blocks using concepts from linguistics, statistical and deep machine learning, algorithms, and data structures. It provides insight into the challenges associated with machine translation and introduces novel approaches that might lead to better machine translation systems.",
        "genEd": "none",
        "credithours": "Credits 5",
        "instructor": "none",
        "extrarequirements": "Requirements Prerequisite(s): NLP 201 and NLP 243 or CSE 244B. Concurrent or previous enrollment in NLP 202. Enrollment is restricted to natural language processing graduate students and computer science and engineering Ph.D. students, or by permission of the instructor.",
        "quarteroffered": "none",
        "fulldesc": "NLP 267 Machine Translation\nMachine Translation systems can instantly translate between any pair of over eighty human languages such as German to English or French to Russian. Modern translation systems learn to translate by reading millions of words of already translated text. This course covers the models and algorithms used by such systems and explains how they are able to automatically translate one human language to another. The course covers fundamental building blocks using concepts from linguistics, statistical and deep machine learning, algorithms, and data structures. It provides insight into the challenges associated with machine translation and introduces novel approaches that might lead to better machine translation systems.\nCredits 5\nRequirements Prerequisite(s): NLP 201 and NLP 243 or CSE 244B. Concurrent or previous enrollment in NLP 202. Enrollment is restricted to natural language processing graduate students and computer science and engineering Ph.D. students, or by permission of the instructor.\n"
    },
    {
        "coursename": "NLP 270 Linguistic Models of Syntax and Semantics for Computer Scientists",
        "description": "Provides an introduction to theoretical linguistics for natural language processing, focusing on morphology, syntax, semantics, and pragmatics, and on training students in linguistic description, representation, and argumentation. Students learn to describe common features underlying natural languages and to manipulate several syntactic and semantic representations.",
        "genEd": "none",
        "credithours": "Credits 5",
        "instructor": "Instructor Pranav Anand",
        "extrarequirements": "Requirements Enrollment is restricted to natural language processing graduate students and computer science and engineering Ph.D. students, or by permission of instructor.",
        "quarteroffered": "Quarter Offered Winter",
        "fulldesc": "NLP 270 Linguistic Models of Syntax and Semantics for Computer Scientists\nProvides an introduction to theoretical linguistics for natural language processing, focusing on morphology, syntax, semantics, and pragmatics, and on training students in linguistic description, representation, and argumentation. Students learn to describe common features underlying natural languages and to manipulate several syntactic and semantic representations.\nCredits 5\nInstructor Pranav Anand\nRequirements Enrollment is restricted to natural language processing graduate students and computer science and engineering Ph.D. students, or by permission of instructor.\nQuarter Offered Winter\n"
    },
    {
        "coursename": "NLP 271A Capstone I: Recent Research in NLP",
        "description": "The first in a sequence of three capstone courses providing hands-on practice of key NLP concepts and skills and experience working in a team project setting. Provides students with tools for project management and working in a team. Explores multiple possible projects, and methods for presenting projects, and investigates what makes a good project proposal, and how to evaluate and understand the strengths and weaknesses of project proposals. (Formerly Capstone I: Natural Language Processing.)",
        "genEd": "none",
        "credithours": "Credits 5",
        "instructor": "Instructor Adwait Ratnaparkhi",
        "extrarequirements": "Requirements Prerequisite(s): NLP 201 and NLP 220. Enrollment is restricted to natural language processing graduate students.",
        "quarteroffered": "Quarter Offered Winter",
        "fulldesc": "NLP 271A Capstone I: Recent Research in NLP\nThe first in a sequence of three capstone courses providing hands-on practice of key NLP concepts and skills and experience working in a team project setting. Provides students with tools for project management and working in a team. Explores multiple possible projects, and methods for presenting projects, and investigates what makes a good project proposal, and how to evaluate and understand the strengths and weaknesses of project proposals. (Formerly Capstone I: Natural Language Processing.)\nCredits 5\nInstructor Adwait Ratnaparkhi\nRequirements Prerequisite(s): NLP 201 and NLP 220. Enrollment is restricted to natural language processing graduate students.\nQuarter Offered Winter\n"
    },
    {
        "coursename": "NLP 271B Capstone II: Natural Language Processing",
        "description": "The second capstone course providing hands-on practice of key NLP concepts and skills and experience working in a team project setting. Provides students with tools for project management and working in a team. Allows students to refine and define several possible projects, present them for feedback, produce initial implementations of key modules and assess them, and complete the capstone project, which includes testing and assessing the quality of the final implementation, writing the final project report, poster creation, video and oral presentation of the project as a team.",
        "genEd": "none",
        "credithours": "Credits 10",
        "instructor": "Instructor Adwait Ratnaparkhi",
        "extrarequirements": "Requirements Prerequisite(s): NLP 202 and NLP 271A. Enrollment is restricted to natural language processing graduate students.",
        "quarteroffered": "Quarter Offered Spring",
        "fulldesc": "NLP 271B Capstone II: Natural Language Processing\nThe second capstone course providing hands-on practice of key NLP concepts and skills and experience working in a team project setting. Provides students with tools for project management and working in a team. Allows students to refine and define several possible projects, present them for feedback, produce initial implementations of key modules and assess them, and complete the capstone project, which includes testing and assessing the quality of the final implementation, writing the final project report, poster creation, video and oral presentation of the project as a team.\nCredits 10\nInstructor Adwait Ratnaparkhi\nRequirements Prerequisite(s): NLP 202 and NLP 271A. Enrollment is restricted to natural language processing graduate students.\nQuarter Offered Spring\n"
    },
    {
        "coursename": "NLP 280 Seminar in Natural Language Processing",
        "description": "Weekly seminar course covering current research and advanced development in all areas of Natural Language Processing. The seminar is based on invited talks by guest speakers from industry research and advanced development working in the area of Natural Language Processing. Students attend talks given by speakers in a weekly seminar series and participate in discussions after the talks. This class can be taken for Satisfactory/Unsatisfactory credit only.",
        "genEd": "none",
        "credithours": "Credits 2",
        "instructor": "Instructor Adwait Ratnaparkhi",
        "extrarequirements": "Repeatable For Credit Yes",
        "quarteroffered": "Quarter Offered Fall, Winter",
        "fulldesc": "NLP 280 Seminar in Natural Language Processing\nWeekly seminar course covering current research and advanced development in all areas of Natural Language Processing. The seminar is based on invited talks by guest speakers from industry research and advanced development working in the area of Natural Language Processing. Students attend talks given by speakers in a weekly seminar series and participate in discussions after the talks. This class can be taken for Satisfactory/Unsatisfactory credit only.\nCredits 2\nInstructor Adwait Ratnaparkhi\nRequirements Enrollment is restricted to natural language processing graduate students and computer science and engineering doctoral students. Others may enroll by permission of instructor.\nRepeatable For Credit Yes\nQuarter Offered Fall, Winter\n"
    }
]